video_id,channel_title,video_title,upload_date,view_count
-Cz78DMbZpg,Durv,Did I Fake Giftcard Giveaways? (Durv Q&amp;A),2021-11-03,79552
he0xFh0Ggmk,Durv,I&#39;m back (Durv Update),2021-01-12,382632
RbGvDOSZ67I,Cold Ones,We Applied HIGH VOLTAGE To Kids Toys,2024-02-08,800569
c0z5H5Izga4,Cold Ones,We Made Our Own Alcohol.,2023-08-29,803298
VfBLynzgY8g,Cold Ones,Lachlan Explains in Fortnite Terms | Cold Ones,2022-07-05,832243
byVtM9joVVE,Cold Ones,Getting Groggy with Yung Gravy | Cold Ones,2023-06-01,876519
KA1Atd_BsKw,Cold Ones,bbno$ goes lalala | Cold Ones,2020-03-08,911925
sAJWD-0dxk8,Cold Ones,Paying Gus Johnson $2000 to Shave his Moustache | Cold Ones,2019-06-09,976504
gRvPP2hqglE,Cold Ones,We Became ANIME (ft. @TrashTaste ) | Cold Ones,2023-07-08,983257
RhseHQCNmyo,Cold Ones,We Tried DRUNK Drawing with Egoraptor,2023-09-17,989177
rplC24yHtLw,Cold Ones,Going Drink for Drink with RackaRacka | Cold Ones,2020-03-30,1073618
uAnYYGHbWQw,Cold Ones,Breathalyzer Bingo  ft. Nerd City | Cold Ones,2019-02-04,1084557
GTRUeT1V0Rs,Cold Ones,We Delivered FREE GIFTS to Strangers!,2023-12-23,1145767
IDu7oXGZGcI,Cold Ones,We Tried Painting Without Brushes,2023-10-17,1235510
jULqTXf1ocw,Cold Ones,Keemstar Starts Some Drama | Cold Ones (ft. ColossalisCrazy),2020-02-22,1276269
XcuYwo1G5kI,Cold Ones,HOW TO DRESS FOR A TINDER DATE (ft. Fairbairn Films),2018-11-17,1329817
E_xX1f6nIcQ,Cold Ones,PayMoneyWubby Gets a Haircut | Cold Ones,2022-08-01,1424253
AZCeli6wZ7Y,Cold Ones,Sean Evans Talks Hot Ones While Drinking Cold Ones,2020-10-01,1461455
ysrstv22qRI,Cold Ones,Zuckles Drinks Himself into Brain Damage | Cold Ones,2019-12-29,1482964
SVIWx6PuSOs,Cold Ones,What happened last night? ft. Fairbairn Films | Cold Ones,2019-04-03,1600012
5jlFlov6GUY,Cold Ones,ColossalisCrazy Reveals his Face with Dolan Dark | Cold Ones,2019-06-24,1605761
Ey5PJdcjYKs,Cold Ones,We Tested ICONIC Toys from Every Era,2023-10-08,1702491
twZH4dVtlZA,Cold Ones,Chillin&#39; with Cherdleys | Cold Ones,2019-08-26,1704728
D4dx1aoypys,Cold Ones,We Gave CHEAP and EXPENSIVE Designers the Same Brief,2023-11-05,1735927
jwUCSw0ZG4M,Cold Ones,We Spent $5000 on FAKE Temu Products,2024-01-20,1802425
rnBxeYSR4GA,Cold Ones,We Tested SHOCKING Tik Tok Gadgets,2023-12-17,1815941
nkSAgXxFy84,Cold Ones,Celebrity Lookalikes on CAMEO will say ANYTHING!,2023-07-23,1827080
wN9DPMO-Grk,Cold Ones,Coming Out Again with Pyrocynical | Cold Ones,2019-10-26,1869948
UDQds7VZkfg,Cold Ones,We Drank AI&#39;s Horrible Cocktail Ideas,2023-09-06,1896472
vGutD5JfEJ0,Cold Ones,We Tested the WORST REVIEWED Drinking Games on Amazon,2023-09-23,1899235
ysg_u7nSeW8,Cold Ones,Our Phone Number Got Leaked...,2022-05-22,1904264
9OVqasb7BpA,Cold Ones,Jacksfilms Ruins his Marriage while Sinking Cold Ones,2019-05-06,1965244
JM68meH3FY8,Cold Ones,Ian from Smosh Starts Food Battle 2020 | Cold Ones,2020-05-03,2040557
7m4aTVQBqC8,Cold Ones,"We Donated $10,000 to Streamers as Mr Beast",2021-07-04,2048373
pxgHVYeoBYI,Cold Ones,Trying Pottery was a Mistake...,2022-02-08,2058304
gy86Rc7Zye0,Cold Ones,Australians Attempt Pumpkin Carving,2021-10-27,2068570
q_V01KiZJQE,Cold Ones,We Have A Stalker...,2022-07-09,2100009
LkYQ7JE7Lbs,Cold Ones,Playing the WORST Drinking Games with The Boys,2022-10-01,2131194
6kTIzMbd--s,Cold Ones,Coming out? ft. Pyrocynical &amp; Dolan Dark | Cold Ones,2018-11-11,2166416
PLu6aRs7x04,Cold Ones,Paying Food Delivery Drivers to Eat With Us,2021-03-01,2185663
f8MDnK79Iz4,Cold Ones,We Flew Around the Globe to try the WORST Local Alcohol,2023-12-09,2191558
XEMCIsZbtEg,Cold Ones,We Tested Expired Military Rations,2023-08-01,2213290
bScQmbx4Jqk,Cold Ones,It&#39;s Been a Fun Ride | Cold Ones,2020-07-03,2217962
xPTsW2nwBVE,Cold Ones,We Painted in Third Person,2021-12-27,2232248
t1VKydCHX2Y,Cold Ones,Drunk Santa Surprises Fans with Christmas Gifts,2021-12-19,2231967
tOF7PG_Y39k,Cold Ones,Blind Tasting CURSED Vodka Infusions,2023-08-17,2237928
UHi423WdtxU,Cold Ones,Drunk Australians Attempt Graffiti (ft. Lushsux),2021-06-11,2241056
xD7aA_LJykw,Cold Ones,We Tested MASSIVE Versions of Everyday Items,2023-04-15,2260800
Xkj6jQaxpAQ,Cold Ones,We Tested Bootleg Drinking Games,2023-06-17,2291708
-2rSaG-aCmk,Cold Ones,Tweet or Drink ft. @Fitz &amp; @SwaggerSouls | Cold Ones,2020-12-19,2301969
yY4jaIMMWqA,Cold Ones,Testing GARBAGE Tech with DankPods,2022-12-04,2308363
Nb0I8xx1Y4I,Cold Ones,The Taser Cup! (ft. Michael Reeves) | Cold Ones,2019-05-25,2335003
gZEkMUzYSmA,Cold Ones,We Made Beer Pong Even Worse...,2023-03-09,2340308
OT-osHVZUtI,Cold Ones,We TRICKED CELEBRITIES into Saying This...,2021-01-31,2363426
pkCVQk7qnJQ,Cold Ones,I Did a Thing Does a Thing | Cold Ones,2021-01-26,2411839
7wlYX8XDINA,Cold Ones,"We Gave Streamers $10,000 to Do This...",2020-08-04,2455054
YA0m69FPPpo,Cold Ones,Drunk Australians Try Science,2023-04-01,2468741
EElQEg38XyI,Cold Ones,Surprising Fitz with his Old Tweets | Cold Ones,2019-07-28,2496048
eXfeM68I4h8,Cold Ones,"Opening the $30,000 Chinese Mystery Crate",2023-12-01,2561223
4ypMJzeNooo,Cold Ones,Drunk Painting from Memory,2021-02-07,2564835
8ZitouI21GM,Cold Ones,Ludwig | Cold Ones,2022-10-22,2575077
d4_nQf6koyo,Cold Ones,We Tried DESPERATELY to Break A World Record,2022-12-13,2614055
BStzTeSjQJw,Cold Ones,"We WASTED $20,000 on Custom Etsy Junk",2023-05-21,2643752
t_JCPWpJarU,Cold Ones,"We Paid Fiverr Musicians $10,000 to Make DUMB Music",2022-08-18,2667876
RawbdPc_d78,Cold Ones,Demonetisation Drinking Game ft. SwaggerSouls | Cold Ones,2019-01-06,2675443
9JMyCMI9HgQ,Cold Ones,These Companies Are Stealing Our Merch (So We Bought It),2020-08-30,2697429
lEQKUqERpuU,Cold Ones,"We Paid $10,000 for CURSED Animations",2022-11-13,2730046
BNEfW3uoKCY,Cold Ones,"We Travelled 10,000km to the World’s Most Remote Desert Pub",2023-06-10,2790451
YdAbhd4X4V0,Cold Ones,EPIC PRESENT HAUL (Over 30 Gifts),2019-12-25,2801513
_QSak6vTF0M,Cold Ones,Calling an Old Friend...,2021-11-14,2848284
23b-uwda5tQ,Cold Ones,REAL vs. FAKE Alcohol Taste Test,2023-02-28,2977099
iaVrCWvyewc,Cold Ones,FLIRTING WITH FAN&#39;S MUMS WHILE DELIVERING MERCH!,2018-05-03,3007371
OGCx_qzONYw,Cold Ones,Don&#39;t Put This in a Chocolate Fountain...,2021-09-06,3098129
hC_Bt9hYApQ,Cold Ones,Belle Delphine Sent Us This Mystery Box!,2020-10-12,3156610
JPX2AkxpCms,Cold Ones,$1000 UBER EATS MUKBANG (ft. Delivery Guy),2020-02-06,3174969
r91YC7W1QfE,Cold Ones,We LEAKED OUR ADDRESS and THIS Arrived...,2021-07-13,3197275
TorbQFIqTGU,Cold Ones,We Turned KIDS TOYS into DRINKING GAMES,2022-08-27,3245725
Q457D4OWlEE,Cold Ones,We Tried INSANE TikTok Products,2023-01-08,3334504
y4obKWHGlC8,Cold Ones,Don&#39;t Air Fry These Things...,2021-04-21,3434648
w-7Ow8zcuL0,Cold Ones,"We Spent $10,000 on the Dumbest Gifts",2020-12-24,3471771
uoWQ7DTMzh8,Cold Ones,We Tried Doing 5 Minute Crafts in 1 Minute...,2022-02-20,3555278
Tq6cjminNHY,Cold Ones,We Were Tricked into Eating This...,2021-11-19,3581571
oXRTSPzuahs,Cold Ones,We Paid Celebrities on Cameo to say...,2020-05-26,3591891
GiZ100Whhdc,Cold Ones,We Put &quot;As Seen On TV&quot; Cleaning Products TO THE TEST,2022-11-19,3672858
E2OGbDBiGnQ,Cold Ones,These &quot;As Seen on TV&quot; Fitness Products SUCK,2022-01-12,3669752
jqu3uENcZqo,Cold Ones,These CELEBRITIES Will Say ANYTHING For Money!,2021-08-21,3675586
B5l7HO-NH4g,Cold Ones,Doing Every Old Internet Meme Challenge,2021-04-06,3711249
5BOg90I0bAU,Cold Ones,"We Spent $30,000 On Custom Etsy Products",2022-04-23,3753685
Sh2Pjr89rF0,Cold Ones,Testing FLAMMABLE TikTok Life Hacks,2021-05-02,3808459
LSFV3jstmgQ,Cold Ones,Testing the CHEAPEST (Worst) Drinking Games from Wish,2020-06-09,3832584
nO_9O_-a6Q0,Cold Ones,We Tried the WEIRDEST Alcohols in the World,2022-09-18,3992397
61ktZB3VIsg,Cold Ones,"We Paid Fiverr VFX Artists $10,000 to do this…",2021-12-08,3973689
qNLGc9SCFF4,Cold Ones,Testing the WEIRDEST TikTok Life Hacks,2021-08-04,4088831
5sRVxb2wkGM,Cold Ones,We Bought Every Weird Ad We Saw,2022-10-11,4126629
SrOUAHy3KPI,Cold Ones,WE PAID THE CHEAPEST FIVERR ARTISTS TO DESIGN DUMB SHIRTS (Then Made Them),2020-11-08,4156068
1htSU3WLZlc,Cold Ones,We Tested FAILED Shark Tank Products,2023-05-09,4198608
yH-Xmy5AZt0,Cold Ones,Wish Items that are NOT Legal (We Bought Them Anyway),2020-04-22,4198975
Eh17H0a8SXw,Cold Ones,HowToBasic Speaks | Cold Ones,2019-09-25,4264374
XoJsxF8zcZI,Cold Ones,"We Spent $5,000 on the Wish BLACK MARKET",2022-11-30,4333857
YTxAUA2leVc,Cold Ones,SuperMega Get SuperGrogged | Cold Ones,2019-10-14,4361956
OU1rI80b5bI,Cold Ones,Will It Carbonate and How Does It Taste?  (Feat. @HowToBasic ),2020-12-10,4353571
Ib_lBfhO-qE,Cold Ones,Twomad Goes to Bed | Cold Ones,2019-11-25,4385757
kY2OeSwL7-s,Cold Ones,Don&#39;t Blend These Things...,2021-02-16,4505058
KgfQeytyQiA,Cold Ones,We Tricked Brands into Sending us Free Stuff,2021-06-27,4698529
D4ehxKsE444,Cold Ones,We Bought Cheap Garbage from TikTok,2022-06-07,4802674
0ulzc1CMROg,Cold Ones,Paying the MOST EXPENSIVE Designers on Fiverr to Make Dumb Shirts (Then Selling Them),2020-05-12,4816457
_L58WoKYEtQ,Cold Ones,Testing VIRAL TikTok Life Hacks,2020-07-11,4887031
UrM0IiGghCw,Cold Ones,"We Paid Animators $10,000 for THIS?",2021-05-31,5048115
scaLOEaDvTA,Cold Ones,Paying Designers to Design Dumb Shirts (Then Selling Them),2019-09-17,5141281
gwHcr07TntI,Cold Ones,These &quot;As Seen on TV&quot; Products SUCK,2020-07-26,5302091
0NVkhEmpEww,Cold Ones,We Tested AWFUL Celebrity Alcohol (AGAIN),2022-12-22,5383423
vkDWHiphPz4,Cold Ones,DO WE STILL TALK TO... ft. Maxmoefoe | Cold Ones,2018-12-10,5435961
FNBJH6ENvKM,Cold Ones,We Tried the DUMBEST Shark Tank Products,2022-07-23,5560258
a5M_FI_BrH4,Cold Ones,Trying the World&#39;s Most Famous Alcohol,2022-03-06,5745549
qVeWUHa5QhY,Cold Ones,$50 VS $5000 Blindfolded Alcohol Taste Test,2021-07-19,6271784
8o9ZAuLQCrA,Cold Ones,We Bought the MOST DANGEROUS Items on Wish,2021-10-10,6430225
LfffrqD4ap8,Cold Ones,We Drank Every Countries National Alcohol,2022-07-17,7092193
vrbAKFk4uhg,Cold Ones,Testing the Cheapest Drinking Games on eBay,2019-12-01,7409439
h-GQlkyU7p4,Cold Ones,PewDiePie | Cold Ones,2019-07-10,7827201
D5zx2Bm2xMk,Cold Ones,Belle Delphine | Cold Ones,2020-10-28,8058687
TkWSFoZp0UY,Cold Ones,We Bought Every Dumb Ad We Saw,2021-09-23,8820415
Ns6acW9RFqs,Cold Ones,These &quot;As Seen on TV&quot; Cooking Gadgets SUCK,2021-05-21,8874241
FgnXJu7jU9Q,Cold Ones,Trying the World&#39;s Strongest Alcohol,2021-05-09,15611011
zLfFKJFV0Yc,The Onion,Landmark Supreme Court Decision Lets Americans Cram Cash Directly Into Politicians&#39; Mouths,2014-04-04,287740
eMQkB0ibwDw,The Onion,Obama Proposes $4 Trillion Piece Of Empty Rhetoric,2014-03-07,287593
VBGFQpkFNgU,The Onion,Crime Reporter Links Warehouse Fire To Depraved Sex Act,2009-09-29,287944
ZxlunxSZ-Yc,The Onion,New Law Legalizes Brandishing Guns At Head Level (Season 1: Ep 9 on IFC),2011-09-30,287622
ogx_24aoRpg,The Onion,The Onion Reviews &#39;Avengers: Age Of Ultron&#39;,2015-04-30,290260
o6JFUWgiGwc,The Onion,The Onion Reviews ‘Spectre’,2015-11-06,291099
MnX0-TayVjk,The Onion,Climate Change Researcher Describes Challenge Of Pulling Off Worldwide Global Warming Conspiracy,2017-09-08,291278
U6Rj9jOP0Vw,The Onion,How One Hot New Device Helps Couples Drag Out Their Doomed Relationship That Extra Month Or Two,2013-04-18,293748
xHaIENgkCQQ,The Onion,The Onion Reviews ‘Mulan’,2020-09-04,295482
HaCChcQUJiM,The Onion,Chinese Gossip Blogger Fights For Freedom To Post Celebrity Up-Skirt Photos,2010-12-03,296853
IWpnzprnmeI,The Onion,Could Plastic Surgery Be Your Ticket To Employment? - Dr. Good - Ep. 2,2013-05-22,299186
rx2vQaWeF6M,The Onion,"Santorum Now Viciously Condemning Homosexuals, Minorities, Women For $100,000 Speaking Fee",2012-05-16,301309
66Cl_0NNhdM,The Onion,The Only Person Who Can Help Me Get A Bus To Yonkers Is You,2014-07-07,307301
LxbDjOoFWdQ,The Onion,Middle-Aged Waiter Sadly Not Involved In Any Creative Endeavor,2014-02-14,306753
0HbHT_ECHaA,The Onion,Police Officers Explain Why They Are Resigning En Masse #reddit #askreddit #question #viral #police,2023-05-02,308918
ZWWjQ9vexhE,The Onion,The Onion Reviews &#39;Captain America: Civil War&#39;,2016-05-05,309846
BJhdaGxsl48,The Onion,The Onion Reviews ‘Onward’,2020-03-06,311284
0M2YWLzgxtg,The Onion,The Onion Reviews &#39;Divergent&#39;,2014-03-20,313821
bc2EhbVU3KU,The Onion,Man Keeps Memory Of Dead Teen Alive By Making Her Center Of Elaborate Political Conspiracy Theory,2017-08-14,315598
zh8yzvs8EM4,The Onion,Study: Americans Get Majority Of Exercise While Drunk,2010-10-14,315655
5iaxoDGKaOc,The Onion,Embarrassed Steven Chu Accidentally Calls Barack Obama &#39;Dad&#39; In Cabinet Meeting,2012-01-31,315750
N8OMMMsONf4,The Onion,The Onion Reviews &#39;Fifty Shades Freed&#39;,2018-02-11,315916
HwOjvmiBfDg,The Onion,Obama Befriends Rich Elderly Widow In Hopes She&#39;ll Put Nation In Her Will,2011-05-04,316336
1pMyYuyWFx8,The Onion,This Day In History: The Invention Of The Handjob,2011-01-25,316999
s8KBZXePNh0,The Onion,24-Hour News Cycle Seems Like It&#39;s Taking Forever,2014-01-24,317648
2qTd2WLlE8k,The Onion,Snowy Conditions Proving Hazardous For Nation&#39;s Idiots,2010-12-29,320567
ItIsw2NUmL0,The Onion,These Starbucks orders are truly the worst!!! 😡 #barista #baristaproblems #drinks #worst #askreddit,2022-09-28,325443
MqR9IOrVFPU,The Onion,The Onion Reviews &#39;Batman V Superman: Dawn Of Justice&#39;,2016-03-24,329828
6ogM0aDe2Pc,The Onion,BREAKING: Incomprehensible Shouting Named Official U.S. Language,2011-03-04,330546
I67e0BgDaqc,The Onion,Jim And Tracy Put On Fat Suits To See What Life Is Really Like For Awful Fat People,2011-11-22,330441
GL3E4NhE5ME,The Onion,Man Who Shit Pants In Grade School Awarded Purple Heart,2011-03-02,333676
KNkbdjatwko,The Onion,Should Companies Discontinue Unpaid Intern Fights?,2015-03-10,335491
wSN7RRaeZKk,The Onion,"World Urges Israelis, Palestinians To Focus Mutual Hatred On Region&#39;s Bahá&#39;í Peoples",2014-07-18,335822
c6lyc3OuFTA,The Onion,The Onion Voter&#39;s Guide To Mitt Romney,2012-10-13,337992
F4d8D_RfaCY,The Onion,Was LeBron Too Hard On His Teammates When He Called Them ‘Shitheads Who Should Quit Basketball’?,2019-04-04,338034
_Ta7QG4E5BE,The Onion,Conservatives Define What ‘Woke’ Means To Them #reddit #askreddit #question #viral #republicans,2023-04-06,342700
ez73DdwTFsI,The Onion,"Is Stress Real, Or Are You Crazy And It&#39;s All In Your Head?",2018-05-29,342608
bjs3eg1lqgs,The Onion,How To Survive Being Shot Point Blank In The Chest - Dr. Good - Ep 7.,2013-06-19,343747
IiZeOgxpCmI,The Onion,Loudness Equals Power - Onion Talks - Ep. 2,2012-10-24,344452
9B4CqhOnt-A,The Onion,Romney Wears Anti-Bacterial Yellow Gloves While Greeting Rust Belt Americans,2012-06-26,348583
mwTILq6DtD4,The Onion,Should Animals Have More Eyes? #animals #eyes #wow #yes,2022-08-25,349490
udhwe4VHjng,The Onion,Pigmaster General - Porkin&#39; Across America - Ep. 7,2012-11-29,359710
UF5ZeXOCZBY,The Onion,America&#39;s Roommates Launch &#39;One Vote Doesn&#39;t Matter&#39; Campaign,2012-11-17,361585
z7c_OMWp21g,The Onion,Has Obama Failed To Reduce Hostility Toward Obnoxious Americans Abroad?,2010-10-19,364080
cgxNOot0QI0,The Onion,Burrito à la Jim  -- Porkin&#39; Across America -- Ep. 3,2012-10-25,368241
xEFL4mZa8ys,The Onion,Should More Americans Get In On The EZ-Go Juicer Craze?,2010-04-16,371262
HjxbI8zbCZM,The Onion,Pork Marathon - Porkin&#39; Across America - Ep 5,2012-11-08,372203
nD0gYVJGahg,The Onion,Today Now! - Porkin&#39; Across America - Ep. 8,2012-12-06,371544
94D70lHs4JY,The Onion,How To Sharpen Your Knife With Your Sword,2022-04-12,371402
WCSgetLxpN4,The Onion,Niece To Eat You! - Porkin&#39; Across America - Ep. 6,2012-11-15,375219
cgxNOot0QI0,The Onion,Burrito à la Jim  -- Porkin&#39; Across America -- Ep. 3,2012-10-25,368241
xEFL4mZa8ys,The Onion,Should More Americans Get In On The EZ-Go Juicer Craze?,2010-04-16,371262
HjxbI8zbCZM,The Onion,Pork Marathon - Porkin&#39; Across America - Ep 5,2012-11-08,372203
nD0gYVJGahg,The Onion,Today Now! - Porkin&#39; Across America - Ep. 8,2012-12-06,371544
WCSgetLxpN4,The Onion,Niece To Eat You! - Porkin&#39; Across America - Ep. 6,2012-11-15,375219
5Imw50wtdXM,The Onion,Perfectly Good Tire Just Sitting There Behind The Kroger,2011-02-14,376223
Npk61XnYU-4,The Onion,The Onion Reviews &#39;Gravity&#39;,2013-10-03,381852
oQzbZsmgcYk,The Onion,It Easy To Tell What Area Man Will Look Like As Skeleton,2012-05-09,382877
btJINsfeYhY,The Onion,New Premium Uber Service Lets Users Commandeer Any Car,2015-02-09,383294
-FI_AZTzfok,The Onion,NRA Fights Legislation That Would Ban Gun Sales To Those Currently On Killing Sprees,2013-02-06,384968
RTM3i8UMMxE,The Onion,Nation Somehow Failed To Predict Attack By Michael Bay,2011-07-08,385535
GwlCTc3YluY,The Onion,"Democrats: Obama Has Dicked Us Around For Four Years, Now It&#39;s Our Turn",2012-04-19,386483
o3-n9uHXZqk,The Onion,Help! I&#39;m A Different Height Than Someone Else! - Dr. Good - Ep 4,2013-05-29,386513
gFABajBNDJg,The Onion,The Onion Reviews &#39;Mamma Mia! Here We Go Again&#39;,2018-07-23,387365
0manTRxLuEY,The Onion,Apple Unveils Much-Anticipated iPhone 4SE,2012-09-29,388026
Q9X_sXWoKJE,The Onion,The Onion Reviews &#39;Interstellar&#39;,2014-11-10,390797
teOwOelncCc,The Onion,SPONSORED: New Video Game&#39;s Second-Person Shooter Mode Features Someone Just Describing Game To You,2014-05-27,392324
nIikrFQzS1o,The Onion,Robins: The Perfect Murder Machine - Horrifying Planet - Ep. 4,2012-08-08,392232
4RF70gWlNyw,The Onion,New Psychedelic Weight Loss Drug Transforms Food Into Monstrous Hallucinations,2011-09-23,394201
2nkboMqYhSA,The Onion,The Onion Reviews &#39;Spider-Man: Homecoming&#39;,2017-07-05,398451
w8c_m6U1f9o,The Onion,The Power Of Selling Out: Your Customers As Political Capital - Onion Talks - Ep. 9,2012-12-12,405517
_f9oJikx0-I,The Onion,Spam Crackdown Threatens Koy4Goff&#39;s Penis Enlarger Industry,2009-02-24,407611
WA1sgSgwyYY,The Onion,National Dating Standards Lowered,2011-06-03,413226
kUKW1i5ymw0,The Onion,New Robot Warns When Someone&#39;s About To Walk In On You Masturbating,2011-11-22,416566
lOjKRtZL5Y8,The Onion,Woman Sets Record For Longest Amount Of Time Spent Talking About Oneself,2012-03-07,426674
-kdkFJa2VJM,The Onion,Maximize Your Brainpower By Firing Every Neuron At Once,2014-03-31,430224
05-5uLLoygA,The Onion,"Manatees: I Saw Manatees Gang Rape A Crippled Manatee Once, Really - Horrifying Planet - Ep. 10",2012-09-26,433448
qVVUfqy9yRs,The Onion,The Onion Reviews &#39;Star Wars: The Force Awakens&#39;,2015-12-21,434828
kLQLS93ba3I,The Onion,BREAKING: Hundreds Feared Dead In Coors Light Party Train Crash,2014-01-16,435284
LEybnCEFNXI,The Onion,Where Do You Rank On The Overall Mom Leaderboard?,2015-05-08,435661
yeqwDLsZJn8,The Onion,Quit Whining And Put On A Goddamn Coat: My Journey - Onion Talks - Ep. 8,2012-12-05,436880
mFFGW8DLBrw,The Onion,How Will The End Of Print Journalism Affect Old Loons Who Hoard Newspapers?,2010-03-04,442989
lQoixkM_2u4,The Onion,Popular Children&#39;s Book Author Reveals The &#39;Spooky Truth&#39; About Creepy Conspiracy Theories,2013-04-11,444039
ywRHfNochrs,The Onion,The Onion Reviews &#39;Licorice Pizza&#39;,2021-11-24,445151
GlulkMaHilI,The Onion,Qan You Dig It? - Porkin&#39; Across America - Ep. 2,2012-10-18,449638
WMzO-8tsUNY,The Onion,Insta just got a whole lot safer #Instagram #tech,2022-03-24,452330
zpNgsU9o4ik,The Onion,This App Turns Your Photos into Music If You Want to Do That For Some Reason,2014-03-25,454179
khwQWXs1Uw8,The Onion,New Nike Running App Tells You What You’re Really Running From,2014-08-13,453374
T-fMbN1H4G0,The Onion,How To Increase Your Cognitive Ability By Reading A Fucking Book For Once,2018-06-04,454024
5D2VdaM8OcM,The Onion,Bird Hunted To Near Extinction Due To Infuriating &#39;Fuck You&#39; Call,2010-10-29,465942
07-V3jTy38o,The Onion,Joe Biden Hitchhikes To Democratic National Convention,2012-09-29,474708
dl5kom9thx8,The Onion,They&#39;ve earned it ❤️ #CigsForTeachers #TeacherAppreciationWeek #teacher #FullPacks #NoLoosies,2022-05-02,476710
RMUDw4_e93Y,The Onion,Celebrity Chef Ted Allen Cooks His Favorite Pretentious Foodie Bullshit Meal,2011-11-09,478062
FNUfDYGUueE,The Onion,Morbid Curiosity Leading Many Voters To Support Palin,2011-01-19,485569
pvb8Skhd0nQ,The Onion,"VIRAL VIDEO: High School Sophomore Sinks Incredible, Unnecessary Half-Court Shot",2013-04-29,486288
YyM8g6osBd8,The Onion,Report: Some Sick Fuck Out There Now Supporting Herman Cain Because Of Sexual Assault Allegations,2011-11-30,488911
zWNko6ZSAzg,The Onion,CEO Says Office Shooting Could Not Have Come At A Worse Time For Company,2014-09-17,493865
pgkeIVRGeYE,The Onion,Can A Mother Actually Lift A Car If Her Child Is Trapped Under It?,2017-06-28,493730
a4mMY2Kl3GY,The Onion,Teens Migrating From Facebook To Comments Section Of Slow-Motion Deer Video,2014-03-20,497383
4erdYR7DrsE,The Onion,Kim Jong Il Ends Nuclear Program For Lead In Next &#39;Batman&#39;,2010-12-28,498111
4erdYR7DrsE,The Onion,Kim Jong Il Ends Nuclear Program For Lead In Next &#39;Batman&#39;,2010-12-28,498111
SYSG5iNnew0,The Onion,Embarrassing Bounced Check From Greece Taped Up In IMF Headquarters,2012-03-15,509533
VqDLcYkQ54U,The Onion,What Kind Of Mom Stick Is Right For You?,2015-05-08,518136
oj_K7OKYmgo,The Onion,Obama&#39;s Approval Rating Down After Photos Surface Of Him Eating Big Sandwich All Alone,2012-05-03,519093
7IkskAAJ1rE,The Onion,How To Sharpen Your Knife With Your Sword,2017-12-07,524607
fX50whgnyN0,The Onion,Human Rights Group Campaigns To End Use Of Child Politicians In Africa,2009-07-17,528787
KLhk49iLAQY,The Onion,Group Of Hunky Cardinals Appeals To Pope To Relax Celibacy Requirement,2012-06-21,532987
ByOiGao50aU,The Onion,A Recap Of This Week&#39;s Royal Baby Coverage,2013-07-26,539756
7qYL_KT06-U,The Onion,Today Now!: Save Money By Taking A Vacation Entirely In Your Mind,2011-06-08,545331
Uu4x8U_PLJA,The Onion,Should The MLB Ban Infield Shapeshifting?,2018-08-16,555020
kbgRk_hlM3U,The Onion,Israel Unveils New Defense System To Deflect Accusations Of Human Rights Violations,2014-07-25,558344
oOGJQD0WXkk,The Onion,Your Brain-Gun: Turn The Safety Off - Onion Talks - Ep. 12,2013-01-02,567248
GDU_8bR1ICc,The Onion,"New Erectile Dysfunction Startup Sends Ripped, Virile Man Directly To Your Door To Bang Your Spouse",2021-01-29,572334
_HE-yx_jzVM,The Onion,Did Media Treat Bachmann Unfairly Because She&#39;s An Insane Woman,2012-01-27,575794
7oOKB44Wk54,The Onion,New Fad Diet Requires You To Stop Eating For A Full 5 Minutes Per Day,2018-05-21,585759
VQhu2k5uQvY,The Onion,Facebook To Allow Changes To Privacy Settings If Users Guess Word In Locket Worn By Mark Zuckerberg,2012-02-28,591034
jrsLMcJn_cA,The Onion,Incredibly Sexy Firefighter Tragically Dies In Steamy Blaze,2010-06-04,596851
KV32uLQGFR8,The Onion,Adults Go Wild Over Latest In Childrens Picture Book Series,2009-12-11,600758
ommzKEdKXVA,The Onion,Blanket Of Snow Creates Illusion That Town Not A Total Shithole,2014-01-10,605668
Baggglxw34w,The Onion,Census Visits Providing Shut-Ins Once-A-Decade Chance For Human Interaction,2010-06-20,608909
l0ndz20w2Oc,The Onion,Onion Explains: Putin&#39;s Russia,2015-08-03,611645
fc9JzvuvNkA,The Onion,"Do Glass Pipes, Incense Prove Teens Are Practicing Shamanism?",2010-06-11,621451
YHe_ToK80Y4,The Onion,How Does A Hive Mind Keep A Synchronized Swimming Team So Coordinated?,2016-08-18,642295
AXjcYQaa7dc,The Onion,God Doubts He Could Still Create World In Just 7 Days Anymore,2014-08-01,643675
-DiBc1vkTig,The Onion,Facebook Employees Explain Struggling To Care About Company&#39;s Unethical Practices When Gig So Cushy,2018-05-02,649188
owZ304DGwlM,The Onion,Parents Explain Why They Are Not Vaccinating Their Children Against Covid-19 #question #askreddit,2022-09-14,651361
8AEMl06leKY,The Onion,Southwest Airlines Rolls Out New &#39;Loyalty Goes Both Ways&#39; Campaign,2014-03-11,662632
S0-gZygKv6c,The Onion,Man Approaching Attractive Woman Fails To Notice Chelsea Handler Book Until It&#39;s Too Late,2012-06-06,668583
53tGLKlsQv8,The Onion,Onion Explains: The Rise Of China,2015-08-03,684734
kH9wvpItrno,The Onion,ClickHole: Here&#39;s THE Perfect Recipe For A Healthy 20-Minute Dinner,2014-08-04,688035
AhEo5n-mSHE,The Onion,Amazing Dance Prodigy Hopes New Ballet Will Inspire Her Dad To Notice Her For Once,2013-03-21,693122
H-fC9uNyhWo,The Onion,Chimpanzees: Dumber Than All Humans - Horrifying Planet - Ep. 2,2012-07-25,693222
mv6Be-fdBs4,The Onion,Man Who Crossed US In Balloon Only Talks About Horse Abuse,2009-01-08,695417
ED3qoGEiWcU,The Onion,Report Finds Troubling Rise In Teen Uranium Enrichment,2011-02-16,696648
_zgb8N-5py0,The Onion,Final Minutes Of Last Harry Potter Movie To Be Split Into Seven Separate Films,2011-05-24,698199
HWxpC8WiO7M,The Onion,Black Conservatives Support Candidate Whose Religion Believes Black People Bear Mark Of Cain,2012-03-14,698670
zWZngM7ROAo,The Onion,The Onion Reviews ‘Toy Story 4’,2019-06-19,729584
aqNaAU2vXlI,The Onion,The Beijing Olympics - Are They A Trap?,2008-07-31,738340
v9d09JLBVRc,The Onion,The Onion Reviews &#39;Dawn of the Planet of the Apes&#39;,2014-07-10,738285
cNZx9Ic6DM0,The Onion,Romantic Boyfriend Surprises Girlfriend With Valentine’s Day Love Labyrinth,2015-02-16,744946
PwQns6vGfj4,The Onion,Jim Haggerty Porks The USA! -- Porkin&#39; Across America -- Ep. 1,2012-10-11,746490
kaoejgnFFP8,The Onion,Markets In Turmoil As Price Of Money Skyrockets To $90 A Dollar,2013-06-24,750110
ob6i-zUWa8g,The Onion,Asian-American Actresses Describe Struggle Of Constantly Being Typecast As Sherlock Holmes,2017-09-13,757107
dwr7kra38x8,The Onion,"Horrific Wall Street Allegations Reveal Junior Bankers Forced To Survive On $6,800 Per Week",2014-01-18,758094
IkS_34Ek-6U,The Onion,The Onion Reviews ‘Wonder Woman 1984’,2021-01-04,768475
8wpYvvgkLuk,The Onion,Who&#39;s Fucking: Zack and Evan,2014-06-18,785015
tom6_ceTu9s,The Onion,"Ducks Go Quack, Chickens Say Cluck - Onion Talks - Ep. 3",2012-10-31,785710
