video_id,channel_title,video_title,upload_date,view_count
KT5-F-CtyeU,Collins Key Top Videos,Insane Food Art Challenges &amp; How To Make The Best Disney Avengers DIY Edible Art | Collins Key,2022-11-25,3057857
Ar5lUIj38RI,Collins Key Top Videos,Extreme Would You Rather In Real Life!! Facing World&#39;s 100 *Most Dangerous* Challenges in 24 Hours,2023-07-08,3063316
LIyKGovFoyE,Collins Key Top Videos,"MOST EXTREME Challenges! [SHOCKING!!] Breaking Rules, Hot vs Cold Dares &amp; Trying 100 Spiciest Foods",2023-04-20,3143036
bYBsDJ4mcjA,Collins Key Top Videos,"TRYING 100 LIFE HACKS IN 24 HOURS!! Breaking Rules, Facing Fears Blindfolded &amp; Dates vs Pranks",2023-03-09,3348438
cMfTSkDNKf8,Collins Key Top Videos,"1,000 PRANKS IN 24 HOURS!! Funny Prank War + Breaking 100 Rules vs Laws &amp; Best Rainbow Friends Dates",2022-12-24,3862559
wG39zeZ1Ocs,Collins Key Top Videos,Eating Only One Color Of Food For 24 Hours!! How To Break 100 Rules with Rainbow Foods vs Friends,2023-01-12,4003173
5466FoBnqqM,Collins Key Top Videos,FUNNIEST PANCAKE ART vs MYSTERY WHEEL Challenges! How To Make DIY Minecraft &amp; Marvel | Collins Key,2022-10-27,4121926
vKrfc82LhYk,Collins Key Top Videos,Best of Food Art Challenges!!! *Must See* How To Make The Best Disney Avengers &amp; Minecraft Art,2022-12-15,4223069
6RQaqr9TdCY,Collins Key Top Videos,Minecraft NOOB vs PRO: Pancake Art Challenge! How To Make Five Nights at Freddy’s vs Rainbow Friends,2023-09-28,4443183
ce7evX0vMfA,Collins Key Top Videos,Minecraft NOOB vs PRO: Food Challenge! Plus How To Make Garten of BanBan Pancake Art &amp; Roblox Candy,2023-06-13,4505410
gW8n_uyNOLg,Collins Key Top Videos,"BREAKING 100 RULES IN 24 HOURS!! Busting Myths, Breaking Laws &amp; Destroying Dates vs Pranks",2022-12-20,4556192
Szn-yCh3zo0,Collins Key Top Videos,Best of Making Food Out Of Candy Challenges!! *Must See* Learn How To Make Shocking DIY Prank Foods,2022-12-10,5142593
gBIMjsd5YPc,Collins Key Top Videos,Best Hamster Maze Challenges 🐹 Minecraft vs Pancake Art - How To Escape Extreme Human Traps &amp; Pranks,2022-10-15,5410372
xlwv_DHw1cE,Collins Key Top Videos,"BREAKING 1,000 RULES IN 24 HOURS!! Busting Myths vs Laws, Surviving Pranks &amp; Facing 100 Fears",2023-01-14,5712564
E3wIB1M3coQ,Collins Key Top Videos,Best of Pancake Art Challenges #2!! *Must See* How To Make Rainbow Friends &amp; Minecraft vs Roblox,2023-01-05,6355863
X71TOHRpReA,Collins Key Top Videos,Minecraft NOOB vs PRO: Pancake Art Challenge! How To Make Rainbow Friends vs Roblox Security Build,2022-12-17,7020635
CbN4d56pbf0,Collins Key Top Videos,7 GENIUS Ways To Survive Going BACK TO SCHOOL!!! Epic First Day Pranks vs Best Sour Candy Supplies,2023-08-10,7374583
J6_ux5c7MXk,Collins Key Top Videos,Surviving the World’s Most Dangerous Challenges! Facing 100 Fears &amp; Minecraft Zombies in 50 Hours,2022-12-26,7654930
uSfk_db8Vkc,Collins Key Top Videos,Best of Pancake Art Challenges!! *Must See* How To Make Disney Marvel Avengers &amp; Minecraft vs Roblox,2022-11-27,8789400
PwqDj3Ci0Ko,Collins Key Top Videos,Minecraft NOOB vs PRO: Pancake Art Challenge! How To Make Garten Of BanBan vs Roblox Rainbow Friends,2023-05-25,13289752
o-gdBy_3aHQ,Top10Speed,he can bend water..,2023-03-20,50834
NgCszwHjybU,Top10Speed,this video will make you forget everything..,2022-08-11,51461
tScF50p5Es8,Top10Speed,The Most SATISFYING Video You&#39;ll See Today!,2022-09-09,51890
GvwPfDUuE-A,Top10Speed,World&#39;s *HARDEST* Riddles Only 1% CAN SOLVE!,2023-03-04,52102
n_tjZPUm7As,Top10Speed,The World&#39;s Most Confusing Illusions...(99% Fail),2023-03-19,52760
V26godErqVY,Top10Speed,Try Not To Get Uncomfortable Challenge (Impossible),2022-12-17,52903
5GY9Tme04eE,Top10Speed,this lion NEEDED my HELP..,2023-03-28,53668
kF-JaRCtnrE,Top10Speed,my biggest fart yet...,2023-05-25,53969
iA2OD003ZzM,Top10Speed,Can YOU solve these IMPOSSIBLE riddles? (99% FAIL),2023-03-03,54154
4MqMoT6v7Io,Top10Speed,Guess The Word Mind Tricks Optical Illusions! #2,2023-04-11,54309
CuVlUGmQKPU,Top10Speed,Only Boys Can Read This.. (Can You?),2022-12-29,54390
vpyTfUOlmAg,Top10Speed,he hasn&#39;t peed for a year..,2023-01-31,55295
AHJDkSb-Bz8,Top10Speed,Watch This If It&#39;s Not Your Birthday Today 🥳,2023-06-20,55362
jKw2_qFabqk,Top10Speed,Only Girls Can Hear This Sound...(Can You?),2023-03-18,55650
JsV0G5nCYAQ,Top10Speed,a SPIDER is growing inside her..,2023-06-07,56100
CnNXavt4UEY,Top10Speed,Try Not To Look Away Challenge! (HARD),2023-04-09,56760
XBTa6sxTQvE,Top10Speed,Only Girls Can Read This.. (Can You?),2022-09-04,57622
1w5cr1nTQRU,Top10Speed,Cool Things I Learned From Tik Tok,2022-12-01,57665
Sd3Td9sTd8c,Top10Speed,Try Not To Be IMPRESSED Challenge,2022-11-02,57665
BLRn_KMANv0,Top10Speed,Cool Optical Illusions Of All Time! #1,2023-05-14,58542
qEpY3DK6rkc,Top10Speed,Click Your Gender to enter this video! 😳 (Hurry Up!),2023-06-23,58669
ghdKJ-kZB6c,Top10Speed,This Will DESTROY Your Trust! 😠,2024-02-01,59749
hAMYVi2Ma0U,Top10Speed,he can rap better than drake..,2023-01-30,59143
tYlruwVEFws,Top10Speed,Cute Animals on Tik Tok That Will Make You Laugh,2022-08-13,60016
pN-2P1N_7LY,Top10Speed,kid sucked into water tornado...,2022-08-07,60363
Rf16G3PdwXM,Top10Speed,I will Show Your Face In This Video!! 🤯 (100% Real),2023-01-29,61109
sqV7mzEKXls,Top10Speed,10 Optical Illusions to Try Now - Mindboggling!,2023-04-03,61809
RniE5zXwVns,Top10Speed,huge wave pool malfunction..,2023-03-25,63645
cO4mWAGbWAQ,Top10Speed,Drone CATCHES Wednesday Addams at HAUNTED PARK (we found her!),2023-01-16,64045
2GmTpGhAEiI,Top10Speed,my biggest fart ever...,2023-03-04,64121
pBm-zGQIp8k,Top10Speed,This Video will Freeze Your Hands!! 😱,2023-01-28,64485
VN3dIuM2NDY,Top10Speed,Try Not To Get Uncomfortable Challenge (Impossible),2023-02-13,65061
ZGXugT7PNBw,Top10Speed,"100 chargers, 1 iPhone..",2023-03-11,65278
8FADpXBCgIY,Top10Speed,ocean made of slime..,2023-03-05,65350
xlhJWC2qdoo,Top10Speed,the glass wasn&#39;t strong enough then...,2021-11-02,67448
bvExE_MppD8,Top10Speed,*NEW* IMPOSSIBLE riddles ONLY 1% can solve! (MUST TRY),2023-02-25,68421
NQQfTueMPyI,Top10Speed,ONLY 1% of people can see the *HIDDEN* Word! 👀,2022-12-03,68678
A0JjHo1IA80,Top10Speed,How FAST can you READ!? 🤓,2022-11-02,68774
Mqs7qCDOePo,Top10Speed,giant spider puppet attacks..,2023-04-06,68912
FguJI-XcL7o,Top10Speed,ONLY 1% OF HUMANS CAN HEAR THIS SOUND (CAN YOU?),2023-01-15,69806
xtnMGic9-7k,Top10Speed,i found him living in the sewer..,2021-09-26,70466
N04W7517S3E,Top10Speed,This Water Slide Was SHUT DOWN After This..,2022-08-22,70995
zoqgPCiQaD4,Top10Speed,Dumbest People On Tik Tok,2022-09-18,71265
DHhny-b09mI,Top10Speed,Try Not To Say WOW Challenge (Impossible),2022-11-01,71525
9iy2_GRd1Ak,Top10Speed,This Video will Change Your Hair Color! 😱,2023-01-23,72067
-si4ydsBi4o,Top10Speed,my friend is possessed..,2021-10-31,73046
6E9UlakxAHg,Top10Speed,Design Fails So Bad It&#39;s Actually Funny,2022-09-07,75095
YpEM9KLQRCs,Top10Speed,This video will make you Feel like You&#39;re Flying!! 😱,2023-01-11,75623
PgZwhs6Uqfc,Top10Speed,Embarrassing Tik Toks That Should Have Stayed In The Drafts,2022-10-05,75676
DaUFsT18RPY,Top10Speed,22 OPTICAL ILLUSIONS AND RIDDLES THAT&#39;LL TRICK YOUR MIND,2023-04-02,76075
22Em0YfhQJg,Top10Speed,World&#39;s *CRAZIEST* Optical Illusions! (Mind Tricks),2023-04-29,76220
4ihakoy3bvs,Top10Speed,Most Oddly Satisfying Video to watch before sleep,2022-09-27,77765
Wk_jlgF3sVY,Top10Speed,Try Not To Look Away Challenge! (HARD),2023-03-19,77816
h_a3Jpg-eb8,Top10Speed,All boys hate when this happens...,2023-01-04,78419
kTTxj-6zfEE,Top10Speed,he thought it was dirt...,2023-03-14,78576
5JtViNPuyh4,Top10Speed,Mind Blowing Optical Illusions,2023-04-21,78615
2jkX4v-S_sI,Top10Speed,CAN YOU SPOT THE DIFFERENCE IN THESE PICTURES? (TEST),2022-02-07,79188
QV9jlaSm03s,Top10Speed,shark tank breaks in mall..,2023-01-28,79545
YybI4ZQMyAY,Top10Speed,If you *STOPPED* blinking… 😵,2022-11-12,81005
f7gzx1so1yU,Top10Speed,What&#39;s more DANGEROUS...? 😨,2024-01-11,108849
MiTA8NYWY7c,Top10Speed,Optical Illusions That Will Trick Your Eyes!,2023-03-15,83347
sOYBCk0mJ6k,Top10Speed,TikTok Optical Illusions That Make You See Things,2023-02-12,84075
PzbEJuZG994,Top10Speed,i found this in my car..,2023-03-07,84961
Nuu_i3CS-nw,Top10Speed,Can YOU guess the correct logo? 🤔,2022-11-20,85296
ZePE1wMPLnc,Top10Speed,This Video will Make You See Two New Colors! 😱,2023-06-25,89099
kB4f235wPZg,Top10Speed,Try Not To Say WOW Challenge! (HARD),2023-04-04,90797
NqB71sU5RRI,Top10Speed,BEST OPTICAL ILLUSIONS - Part 3 Top10Speed,2023-04-07,91058
WZAP_dYA2rY,Top10Speed,i told him not to dive there...,2021-12-20,91068
r6AF4Bgqgbs,Top10Speed,"she fell into shark tank, then..",2021-12-07,91930
FP5DonvnEmQ,Top10Speed,Tik Tok Pranks That Went Too Far,2022-10-03,92015
EtN7twNxE8E,Top10Speed,15 Optical Illusions You HAVE to Try,2023-05-01,92162
p-vlhAotnZE,Top10Speed,Try Not To Say WOW Challenge! (HARD),2023-04-01,94307
JLAcdL33x_k,Top10Speed,Don&#39;t Say Eww while watching this video...🤢,2023-03-27,96938
mdHCYC-VFUk,Top10Speed,This Video will Make You See Everything in Blue Color! 😱🔵,2023-01-14,97173
Ulso25_ikbs,Top10Speed,Try Not To Say Wow Challenge (Impossible),2022-09-13,99477
2udtMe6-mvU,Top10Speed,Tik Toks That Escalated Quickly,2022-10-19,102851
y119brtt-YI,Top10Speed,Try Not To Say WOW!,2022-08-18,104443
sX_TbLtGmsk,Top10Speed,Try Not To Get Uncomfortable Challenge (Impossible),2022-11-07,106324
6CGHf-R03NI,Top10Speed,What You See First Reveals Unexpected Truth About You,2023-04-10,106391
PxN2gOE5HrI,Top10Speed,Only Girls HEAR this! 😵‍💫,2022-10-22,107887
Xyp_SNv2RjA,Top10Speed,i shouldn&#39;t have let him do this..,2021-08-04,108073
MEnurLMrGJQ,Top10Speed,Watch if it&#39;s not your Birthday... (Hurry Up!),2023-02-02,108588
OukZWVu3qG4,Top10Speed,Tik Toks That Will Make Your Day Better,2022-09-20,109731
s3F9lWTf88A,Top10Speed,my pet spider escaped.. (HELP),2023-03-24,110384
r_JitDMZ5-0,Top10Speed,Tik Toks That Live Rent Free In My Head,2022-09-24,113033
16e2URLnf8E,Top10Speed,she hasn’t peed for a year..,2023-05-29,114314
noHKUT42VyQ,Top10Speed,I will Make You Fart In 10 Seconds!! 🤯 (100% Real),2023-04-23,115114
cMEt3qm8uko,Top10Speed,CAN YOU SOLVE THESE RIDDLES? (CHALLENGE),2023-01-27,118602
BCzqmojU-kQ,Top10Speed,All girls hate when this happens...,2023-01-12,119145
GqHd2d-8SkE,Top10Speed,Stephen Sharer Forgot To Stop Recording...,2020-07-31,122121
7RemWer5Rq8,Top10Speed,Only Girls Can Hear This Sound..,2023-05-29,122379
yGFjS0cwv0Q,Top10Speed,Only 1% can see *THIS*! 🤯,2022-12-17,123637
rzp6KYFPsNc,Top10Speed,I Will Show Your Age In This Video..,2022-12-25,123945
U3eruFdQhoQ,Top10Speed,I Will Read Your Mind In This Video,2023-02-07,127346
17tgP9Y0Ugs,Top10Speed,CAN YOU SPOT THE DIFFERENCE? (TEST),2023-02-01,127574
zuiXr87C52Q,Top10Speed,TRY NOT TO SAY WOW CHALLENGE... (VERY HARD),2022-09-26,128039
slG7Vga7MRg,Top10Speed,he got super lucky.. (SCARY),2022-11-12,131228
AxKThb8mJdg,Top10Speed,Tik Toks Worth Watching Before It Shuts Down,2022-09-21,131926
Hsz5DxrvyVM,Top10Speed,Did These Optical Illusions Trick Your Mind! (HARD DIFFICULTY),2023-03-31,132805
IUkdF2ryGro,Top10Speed,Try Not To Get UNCOMFORTABLE Challenge,2022-09-08,134748
c0gBIctNrMA,Top10Speed,Can You Spot The Difference With These?,2023-04-09,135279
4s4A0NtbbWY,Top10Speed,She saw an alien.. (HELP),2021-10-23,135630
68A7bUbrDMs,Top10Speed,Try Not To Say WOW Challenge... IMPOSSIBLE,2022-09-16,137807
qCa8LFdlBuw,Top10Speed,this monster won’t stop evolving..,2022-10-11,146225
nvhM11qd_hg,Top10Speed,"kid calls 911 for fun, BIG MISTAKE…",2021-09-20,146318
6NZGV0FQpLg,Top10Speed,I Will Show Your Age In This Video..,2022-08-25,148085
xUYqxjCmsMU,Top10Speed,"If You Say WOW, You LOSE! (IMPOSSIBLE)",2023-03-30,151921
HA3tPLp_n7o,Top10Speed,CAN YOU SPOT THE DIFFERENCE? (TEST),2021-07-07,153438
XoBgh5LxXWc,Top10Speed,This Video Will Make You Fall ASLEEP In 5 Seconds..,2023-01-01,154894
yADdGrSTcjg,Top10Speed,Try Not To Look Away Challenge!,2022-09-03,159011
67wMYY0z-Vg,Top10Speed,Find The Hidden Pictures In The Images... (Mind-Tricks!),2023-04-08,161146
1K-DyDppj1M,Top10Speed,People Having A Worse Day Than You,2022-09-22,169900
EVR2GzHRit0,Top10Speed,I will Show Your Face In 10 Seconds!! 🤯 (100% Real),2023-04-06,171281
Qd8utH-93Fk,Top10Speed,Try Not To Say WOW Challenge! (HARD),2023-03-21,174250
m6H6QfFfBU8,Top10Speed,Only Girls Can HEAR This Sound! 😵‍💫,2022-12-10,175436
_rQMhbI1Wes,Top10Speed,Can You Solve These Optical Illusions - Part 5!,2023-06-01,178503
EzqJC_it1QM,Top10Speed,I will Make You Forget Your Age In 10 Seconds!! 😱,2023-01-21,185580
UcadKyyWams,Top10Speed,this pool should not exist..,2021-08-05,188172
j8XuDVpT_0Y,Top10Speed,This Optical Illusion Will Make Everything Grow Bigger Once You Look Away,2023-05-26,196320
nc8fUw9I77g,Top10Speed,This Pool Will Give You Nightmares…,2021-11-12,198074
YA6Y2305Sl4,Top10Speed,Don&#39;t talk while watching this video,2023-01-13,199165
64jjSJLjjQ4,Top10Speed,World&#39;s *HARDEST* TRY NOT TO LAUGH Challenge! (NEW),2023-02-04,208838
VBoNnQRajDY,Top10Speed,Try Not To Say WOW Challenge (Impossible),2023-03-31,209102
zHl0EfWLxvw,Top10Speed,he broke the polar bear&#39;s glass...,2021-11-06,214833
SHuzFkzCViQ,Top10Speed,this water slide should not exist..,2021-08-03,215234
rbDDUKje_pg,Top10Speed,Can YOU solve these IMPOSSIBLE riddles? (ONLY 1% PASS),2023-02-26,219510
kGNPiwTqhCM,Top10Speed,basketball stuck inside my neck..,2022-09-15,220148
JPiSdgdHXNI,Top10Speed,Try Not To Say Wow Challenge (Impossible),2023-03-26,229808
AG2R5ukfSVo,Top10Speed,INSANE OPTICAL ILLUSION,2023-04-04,234037
F2pQe7xjYHI,Top10Speed,ONLY 1% can see THIS! 🤯 (MUST TRY!),2022-11-26,248296
GWkOcc9Rhtk,Top10Speed,Can You Find The Hidden Panda In This Picture?,2023-01-10,256075
_f48HrcvbPI,Top10Speed,these bugs are really itchy..,2023-06-03,269568
tzWJ2pYKkW0,Top10Speed,i shouldn&#39;t have thrown this rock..,2021-07-25,285691
be_rahc0_80,Top10Speed,Nobody Can See All The Hidden Objects। Optical Illusions । Brain Teasers,2023-03-17,288811
opVRAq8n-MY,Top10Speed,"If You Say WOW, You LOSE! (IMPOSSIBLE)",2023-03-22,290813
9_offuI7ViM,Top10Speed,he jumped without seeing the shark..,2021-07-31,293174
KQCqXbxhwBo,Top10Speed,THIS VIDEO WILL REVEAL YOUR PERSONALITY,2021-07-11,312500
a5toPknE31E,Top10Speed,This Water Slide Will Give You Nightmares..,2021-11-14,321684
kWueJFAz_ag,Top10Speed,how to breathe underwater..,2023-03-18,324086
R7kuNhPdkPQ,Top10Speed,Try Not To Say Wow Challenge (Impossible),2022-11-11,329052
K4bu8dc1ZKQ,Top10Speed,I will Make You Sleep in 10 Seconds! 😱 (Real),2023-01-05,362009
Gkz9yxP05jI,Top10Speed,water hates this guy..,2021-05-22,387070
8Kjgc6s-g8c,Top10Speed,Only Boys Can Hear This Sound..,2022-12-23,394700
AcI0VpyshlE,Top10Speed,This Video Will Show YOUR FACE..,2022-08-02,399384
JtNC9e-HuPk,Top10Speed,Great Random Video!,2022-04-02,399994
6FL4XYNguYw,Top10Speed,These Body Builders Took It WAY TOO FAR..,2021-09-16,410519
DOhHsQnOdJM,Top10Speed,I will Show Your Age In This Video! (Real) 🤯,2023-03-05,444733
sGC3fEqd7vY,Top10Speed,CAN YOU SEE THE NUMBERS? (EYE TEST),2021-07-02,445271
3WUrOV29tBI,Top10Speed,World&#39;s WORST Design Fails! 😂,2024-01-24,522499
nZUfY4UZliM,Top10Speed,I Will Guess Your Age In This Video..,2022-01-26,495838
oUWYHBHQgdI,Top10Speed,the worlds fattest man..,2023-05-27,506536
bXN8qugWaoM,Top10Speed,why did i let my son do this...,2022-07-24,524213
Q4OwJscOKMI,Top10Speed,"10 Youtubers Who FORGOT TO STOP RECORDING! (Ninja Kidz TV, SSSniperWolf, Jelly, Unspeakable)",2021-05-04,539659
e4AN90Mqj2E,Top10Speed,"6 YouTubers HIDDEN in MOVIES! (Unspeakable, Ninja Kidz TV, DanTDM)",2021-05-01,550089
CgIiKqUijEQ,Top10Speed,"If you see Blue, you are in Danger! 😰",2023-01-24,555796
mlTq0nFUMyg,Top10Speed,this video will make you forget your own name..,2022-03-22,563416
3ADVPW8wnZY,Top10Speed,Try Not To Look Away Challenge..,2022-11-08,590761
9Mv5pwORnTA,Top10Speed,"If You Say WOW, You Lose",2022-09-30,692045
0x6f_nD0y18,Top10Speed,Only 1% can see THIS! 😨 (MUST TRY!),2022-11-01,818109
qNe29yEsbR8,Top10Speed,i shouldn&#39;t have thrown this rock.. (HUGE MISTAKE!),2021-05-27,827875
iL-1_RLzZBk,Top10Speed,i have an itchy head...,2022-09-02,844717
dRapdlorzl8,Top10Speed,I will Make You Fart in 5 Seconds! 😳,2023-09-25,903149
mXtq-emTy9I,Top10Speed,You Laugh You Lose But Its Actually Funny,2022-09-28,922263
kE3pdXUGARc,Top10Speed,Optical Illusions to Try Now - Mindboggling! #2,2023-04-01,1016355
HnCXPE9KPHs,Top10Speed,Can You Find The Mistake!? (Hardest Optical Illusion!),2023-01-02,1083787
47nlqdd0Y2I,Top10Speed,CAN YOU FIND THE ODD EMOJI IN THESE PICTURES?,2021-07-15,1168920
SB1v4UI9xT8,Top10Speed,he missed the pool..,2021-07-30,1309642
tHeFH4LQAS0,Top10Speed,this water slide should be shut down...,2021-07-23,1461782
CIIazUB3RaA,Top10Speed,this pool should be shut down..,2021-07-18,1530970
8iOqcJNuzuQ,Top10Speed,Only 1% can see *THIS*! 🤨,2022-10-26,1752756
mBaEhLp4UtU,Top10Speed,Try Not To Say WOW Challenge! (HARD),2022-08-21,1768339
cmxsdvMYSWI,Top10Speed,How Fast Is Your Brain?🧠😱,2022-10-27,1794230
CYEXXOKfaNw,Top10Speed,Only Girls Can See Something in This Mirror,2022-01-16,1873653
x8qdiAODIOk,Top10Speed,I Will Guess Your Birthday In This Video..,2022-01-14,1924609
T80G8F5YTac,Top10Speed,"10 Youtubers Behind The Voices! (Ninja Kidz TV, Jelly, MrBeast, JoJo Siwa)",2021-03-17,1980384
Ub-P0lkW4Vc,Top10Speed,he couldn&#39;t escape the world&#39;s deepest pool..,2021-10-29,2039478
iVMOHpjqkT0,Top10Speed,10 THINGS MOST HUMANS CAN&#39;T DO,2021-07-21,2096507
lo2lZzrfayY,Top10Speed,This Will *CONFUSE* You! 😨,2022-11-09,2229738
uqGOG2Z2M2g,Top10Speed,Do You Have PERFECT Vision? 🧐,2024-01-15,2641960
GWUfl_lx_lo,Top10Speed,I Will Guess Your Age In This Video..,2022-01-07,2314070
U85a0RqwyzQ,Top10Speed,Only Girls Can Hear This Sound...,2022-12-22,2323836
MG-K7vwR5M4,Top10Speed,THIS VIDEO WILL GUESS YOUR AGE,2021-06-22,2617585
czW0XQcEl_Q,Top10Speed,I Will Show Your Name In This Video..,2022-07-29,2666403
aCGwQw9ZMhc,Top10Speed,This Video Will Make You BLIND For 6 Seconds..,2022-03-08,2810920
502UCWJF338,Top10Speed,I Will Show Your Face In This Video..,2022-01-25,2971743
-eV_7Jq91Vo,Top10Speed,If Kid Drawings were Real! 😂,2024-01-26,3485779
EbJjlvfcZqU,Top10Speed,This video will make you forget your name..,2021-05-18,3525566
0mwS-7EYWK0,Top10Speed,I Will Show You Your Name In This Video..,2022-02-01,3657984
9H_evyzUdqc,Top10Speed,This Video Will Control Your Mouth For 6 Seconds..,2022-07-25,3848721
fWjadvMcdu0,Top10Speed,ONLY 1% of people can see the *HIDDEN* Word! 👀,2022-11-04,4566129
Pa9xQaNHTDM,Top10Speed,this video will make you forget everything..,2022-01-30,4740595
iFGuG6XwMjI,Top10Speed,this video will make you feel like you&#39;re flying..,2022-02-05,5147545
C9JyFY_4Ob0,Top10Speed,This will FREAK you out! 😵‍💫,2022-10-31,5899387
BAiO5hX6tAI,Top10Speed,this video will make you forget your name..,2022-02-03,6176866
MKVLIqUEHZM,Top10Speed,he couldn&#39;t escape this water slide..,2021-11-10,6305853
tuVkaI2CAVg,Top10Speed,this video will make you fall asleep..,2022-01-28,6488686
tsv75tpt1Vo,Top10Speed,GUESS the Color! (1% PASS) 🤯,2023-03-13,8118255
YsOIbE6B6ig,Top10Speed,Can YOU see it? 👀,2022-11-18,8159699
7inNICSFxzc,Top10Speed,10 Signs You&#39;re Actually Normal..,2021-03-25,8925877
WLMXBuq11QE,Top10Speed,this video will make you feel like you&#39;re flying..,2021-03-24,12076070
6mz3tCjo4pA,AFKWNINJA,"AFK w/ Kyle Long | NFL Star Turned Gaming Icon, Da Bears vs. The Lions Showdown, Brotherly Rivalr...",2024-01-04,13
t1Mb0hNAz9Q,AFKWNINJA,"Solo Ep | Twitch’s Big Multicast Announcement, Detroit Lions Flop, When We Were Young Fest &amp; Flyi...",2024-01-04,11
uEqy3d0yC7c,AFKWNINJA,"Surprise Guest: The Bearded Blevins | The Duo Dives into Early Gaming, Fame Life, and Keeping Fam...",2024-01-04,13
1EBrrHuktOc,AFKWNINJA,Solo Ep | Fortnite Chapter 1 is Coming Back?!,2024-01-04,13
MkgoupbKJWw,AFKWNINJA,"AFK w/ Steve Aoki | World Tour Madness, Cake Throwing &amp; The Art Of Sleep",2024-01-04,15
hP8o-sRRir0,AFKWNINJA,"Solo Ep | Final Verdict on OG Fortnite, What’s to Come with Chapter 5 &amp; Is Squid Game: The Challe...",2024-01-04,19
L_OXwxBUziI,AFKWNINJA,"AFK w/ Jordan Fisher | The Ultimate Triple Threat: From Broadway to Battle Royale, Favorite Child...",2024-01-04,15
vLtCyAJ-0Tw,AFKWNINJA,"Solo Ep | Thanksgiving Special, Dr. Disrespect’s Return, New Fortnite Goodies &amp; A Surprise Ending",2024-01-04,14
Kx6XfRJfmf4,AFKWNINJA,"AFK w/ Jared Goff | The Best NFL Quarterback, Marrying a Supermodel &amp; His Favorite Off-Field Adve...",2024-01-04,15
0bfXQWJLA1o,AFKWNINJA,"Solo Ep | How I Survived My 35-Hour Stream, EPIC Fortnite Nostalgia Trip, First LIVE Podcast Reco...",2024-01-04,19
Xo8QPZ2Cl_4,AFKWNINJA,"AFK w/ Rick Williams | Designing the Ninja Adidas Shoe, Revolutionizing Art &amp; Sneaker Culture &amp; B...",2024-01-04,17
Ve5V_3lDyqA,AFKWNINJA,The True Meaning Behind AFK And Why I Started This Podcast,2024-01-04,17
gWbXr6PQCuE,AFKWNINJA,"AFK w/ Jordan ‘Legiqn’ Payton | Why Post Malone Loves Country Greg, What Streaming is Really Like...",2024-01-04,17
_Ik43TmjsQE,AFKWNINJA,"Solo Ep | My Dinner with Twitch CEO, The Incredible Lions &amp; NadeShot Baby Announcement",2024-01-04,17
dHvgh0zqM0Y,AFKWNINJA,"AFK w/ Mark Cuban | Life on the Shark Tank, Dallas Mavericks &amp; What’s Next",2024-01-04,21
7QKUVIPv7JY,AFKWNINJA,Solo Ep | The Truth Behind Mixer &amp; Finances As A Streamer,2024-01-04,19
HTz52oivkmU,AFKWNINJA,AFK w/ DrLupo | Is It 2018?! Our Incredible Wives &amp; How Gaming Changed Our Life,2024-01-04,21
M4UlVnpbqZY,AFKWNINJA,"AFK w/ Joshua Weissman | YouTube’s Culinary Beast, His Secret New Restaurant, Making Mouthwaterin...",2024-01-04,23
Iy7vBRPV3mU,AFKWNINJA,"AFK w/ Felicia Day | &#39;The Guild’ Web Series, Building Games in UEFN, Poop Samples &amp; &#39;Third Eye’ H...",2024-01-04,23
R43dmHdAI-o,AFKWNINJA,"Solo Ep | One Of My Biggest Regrets, Taylor Swift &amp; Travis Kelce &amp; Stream Embedding",2024-01-04,26
OHQ8Dc-7Bc4,AFKWNINJA,"Solo Ep | Everything Behind Lego Fortnite, Is it a W or L?",2024-01-04,25
ip7KWI8Njj8,AFKWNINJA,"AFK w/ Matthew McConaughey | The World’s Most Famous Pickle Expert, Lessons in Finding Your Frequ...",2024-01-04,29
F5N77Vf9n0Q,AFKWNINJA,"AFK w/ Trevor May | Goodbye to MLB, Is Minecraft for Kids &amp; How to Run Two Youtube Channels",2024-01-04,29
lKjArxJGg_A,AFKWNINJA,"AFK w/ Polar Inc. | South African Music Producer, First US Tour &amp; Mastering Film Scoring",2024-01-04,30
gJS5OfsR0jw,AFKWNINJA,"Solo Ep | The Hidden Perks of Being a Pro Streamer, Faze Clan Fires CEO &amp; Our Brand New Listener ...",2024-01-04,33
1DSJRnVQnrY,AFKWNINJA,"AFK w/ Alanna Masterson | Surviving Zombies, Walking Dead Behind the Scenes &amp; Twitch ASMR",2024-01-04,42
RmH8N0obvjE,AFKWNINJA,"Solo Ep | Countdown to Chaos: Unveiling Ninja New Year&#39;s Antics, Special Guests &amp; Major Leaks",2024-01-04,35
dUSVPo1wCbU,AFKWNINJA,"Solo Ep | An Honest Reflection On A Year of Multicasting, My Plans For The Future, &amp; What’s Next",2024-01-04,47
ucimm5VvfyA,AFKWNINJA,"AFK w/ CouRageJD | LEGO Fortnite Drama, 100 Thieves’ Business Secrets &amp; Ninja New Years Shenanigans",2024-01-04,71
bu1pf4ZbMDE,AFKWNINJA,"Solo Ep | Have I Thought About Retiring, Leaking My Twitch Revenue &amp; The Importance of a Partner",2024-01-04,68
4WKf00Xg8bU,AFKWNINJA,"AFK w/ Erik Griffin | From Workaholics Acting to Directing Matt Rife’s Comedy Special, Life in Co...",2024-01-04,83
kIBzRtdsR5A,AFKWNINJA,Welcome to AFK w/ Ninja,2024-01-04,89
GYgoB7Q7Jos,AFKWNINJA,"AFK w/ SypherPK | The Trap Tower Legend, Taking Off on YouTube, Running Away from Home &amp; Meeting ...",2024-01-04,137
ZdnnVyS6XLQ,AFKWNINJA,Solo Ep | Ninja’s Exclusive New Fortnite Map &amp; Palworld ‘Pokemon with Guns’ Takeover,2024-02-08,152
KfyT1i8bSbU,AFKWNINJA,"Solo Ep | NINJA NEW YEARS PARTY SPECIAL W/ Dr Lupo, Legiqn &amp; BasicallyIDoWrk",2024-01-04,160
ucduNLi-8TU,AFKWNINJA,"AFK w/ Justin Kenna | The Future of Gaming, FaZe Clan Acquisition &amp; An Epic Football Surprise",2024-02-06,191
bJVim2wdFzc,AFKWNINJA,Solo Ep | My Dry January Challenge &amp; The Lions Epic Playoff Run,2024-02-01,219
WsgzYdDwzyQ,AFKWNINJA,AFK w/ ‘Chica’ Maria Lopez | The Puerto Rican Prodigy Who Conquered Fortnite + Playing Your Own S...,2024-01-30,243
JCmc3IXZKcE,AFKWNINJA,"Solo Ep | Return of the Floss, Ninja New Years Recap &amp; Detroit Lions Playoffs Hype",2024-01-11,270
YSYuhaoIZJo,AFKWNINJA,"Solo Ep | Unveiling My 2024 Masterplan, Secret Collabs &amp; Major Ninja Updates",2024-01-18,289
iu04xehISg0,AFKWNINJA,"AFK w/ Zach King | Most Watched TikTok of All Time, Mind Blowing Magician &amp; Titanic Conspiracy",2024-01-09,310
0YeY3fB2-7Q,AFKWNINJA,Solo Ep | Viral Ninja Low Taper Fade Trend &amp; What Twitch Layoffs Really Means,2024-01-25,312
A6ituxtaQKA,AFKWNINJA,AFK w/ BasicallyIDoWrk | Journey to 4.8 Million YouTube Subs &amp; the &#39;Sweaty&#39; Truth About Gaming Today,2024-01-23,391
zxLWN5h15m8,AFKWNINJA,"AFK w/ Frankie Muniz | Multi-Million Dollar Child Star turned NASCAR Pro, Malcolm in the Middle, ...",2024-01-16,576
MtpRthRoeLM,AFKWNINJA,"AFK w/ Jared Goff | The Best NFL Quarterback, Getting Engaged &amp; Life After Football",2023-11-13,1613
Wx-nZJAvVRI,AFKWNINJA,Solo Ep | The Truth Behind Mixer &amp; Finances As A Streamer,2023-11-13,1832
byrK7G8GaKQ,FaZe Clan,FaZe Clan: #RECOVERY Teamtage,2017-03-04,678882
SDdXboNrVDs,FaZe Clan,The Fortnite God Squad...,2019-02-12,679691
cskCbNvwazg,FaZe Clan,FaZe Rug Made A Scary Movie,2020-10-16,681048
FzHOm8hmpM4,FaZe Clan,FaZe Adapt Cooks the World&#39;s Worst Breakfast,2018-03-24,681554
Q-56q32dcKs,FaZe Clan,FaZe: Black Ops 3 Holiday Teamtage by FaZe Jebasu,2015-12-26,685393
bl4WO3Dh7nI,FaZe Clan,Introducing FaZe Rainbow Six,2018-01-18,687084
