video_id,channel_title,video_title,upload_date,view_count
1nm8cDf3sek,WWE,FULL MATCH — NXT vs. Raw vs. SmackDown - Survivor Series Elimination Match: Survivor Series 2019,2020-11-22,46868979
dmPRZlarppM,WWE,FULL MATCH - Team Raw vs. Team SmackDown - Men&#39;s 5-on-5 Elimination Match: Survivor Series 2018,2020-11-17,55106046
nlBTABDDOI4,WWE,FULL MATCH - Nia Jax vs. Ronda Rousey – Raw Women’s Title Match: WWE Money in the Bank 2018,2020-04-13,56841281
Gca-Gil8Fik,WWE,"Roman Reigns’ unexpected teammates: WWE Top 10, Sept. 28, 2019",2019-09-28,63271692
vwJlXB1OtBo,WWE,FULL MATCH  - Team Raw vs. Team SmackDown – Traditional Survivor Series Match: Survivor Series 2017,2019-11-12,92123872
QZ4RpUcNCl8,WWE,"FULL MATCH - Reigns &amp; Usos vs. Corbin, Ziggler &amp; Roode: SmackDown, Jan. 31, 2020",2021-01-31,97278129
sZX4MmdXPRA,WWE,FULL MATCH - 2020 Men’s Royal Rumble Match: Royal Rumble 2020,2021-01-31,111644854
gD7qJ3TW1jw,WWE,FULL MATCH - Team Cena vs. Team Authority - Elimination Tag Team Match: Survivor Series 2014,2018-11-06,173184743
8CQ3qWgH4B0,CGP Grey,"One Year &amp; 100,000 Subscribers Later (Thank You!)",2012-01-30,398717
ufsYK3Eecw4,CGP Grey,Behind the Scenes of TEKOI,2020-08-11,549816
lvdlzV69IeY,CGP Grey,The Theme System Journal,2020-12-20,567579
CHHRnkkGNyc,CGP Grey,"🐝 Behind the Scenes of Rock, Paper, Scissors! 🪨📄✂️",2023-10-22,573067
z_7N8MFRJkc,CGP Grey,Your New Sidekick (Notepad!),2023-12-05,590577
xJmVuW8atO8,CGP Grey,Getting Vaccinated at the Coolest Place 😎,2021-07-12,633451
gqMxf52CCmk,CGP Grey,❄️🇬🇧 London Snow Day 🇬🇧❄️,2021-01-27,661995
w5UnNpnGSNI,CGP Grey,People Pronouncing Uranus,2012-06-20,757484
FWP41MXLMGY,CGP Grey,An Empty City is Eerie Magic,2021-02-19,844201
SuhGwaZiNIk,CGP Grey,Time Management for Teachers,2011-01-17,907193
Aw9M7dKV0oQ,CGP Grey,What&#39;s Inside the DON&#39;T DIE BOX???,2022-12-01,983364
ZmD9RkCJgDI,CGP Grey,Summer of Grey: Parts 1 &amp; 3,2018-05-03,1007000
t4jhoU8QCbw,CGP Grey,TOP SNEAKY STAMP!!!,2020-09-30,1158892
NVmnLaTXylc,CGP Grey,Looking for Lisa Holst (Re: 10 Misconceptions Rundown),2012-01-24,1223534
hvt5xjZTN1U,CGP Grey,Road Trip Time Lapse Across The Loneliest Road,2019-05-08,1397984
ABMV4wXx6Xo,CGP Grey,Abandoned Nuclear Weapon Facility Exploration,2020-05-12,1406456
LIS0IFmbZaI,CGP Grey,Re: Which Planet is the Closest?,2019-10-30,1419577
aN44ETT6mUY,CGP Grey,"The Future of the Channel, and You",2019-09-17,1447792
G6wYSpLtwRI,CGP Grey,🎄 Grey Grades Canada&#39;s Flags!  (And Merry Xmas!) 🎄,2023-12-23,1452200
swx6VyiJ7TI,CGP Grey,Inside Colorado&#39;s Weed Research Lab,2020-04-20,1455629
f-mHLBD64HM,CGP Grey,SURPRISE VLOG: Las Vegas,2017-06-01,1481452
d6tgmGqXysM,CGP Grey,Testing Tesla on the Deadliest Road in America 🐉,2021-12-14,1605466
wpYtLcRKuPk,CGP Grey,"Re: Leap Years, 2012 &amp; The Mayan Calendar",2012-03-14,1643493
fSwpe8r50_o,CGP Grey,This Journal Keeps Me Productive (&amp; Maybe You Too),2022-01-11,1730837
BHMF-FlkqPw,CGP Grey,An Experiment With YouTube Comments…,2023-04-02,1796248
lFwwo0W5Ugg,CGP Grey,🚨 BREAKING FLAG NEWS: Minnesota Getting a New Flag,2023-12-14,1835014
rbHQObTeLDM,CGP Grey,Behind the Scenes Videos!,2020-03-01,1855732
PmWQmZXYd74,CGP Grey,Can You Win this One-in-a-Million Game?,2023-10-19,1892628
qC5h9zcHmPA,CGP Grey,Ten Years Later,2021-02-27,1922001
wvWpdrfoEv0,CGP Grey,"How AI, Like ChatGPT, *Really* Learns",2017-12-18,2083165
zcZTTB10_Vo,CGP Grey,[UPDATED VERSION!] The Trouble With The Electoral College,2016-11-09,2086808
0JK2dR8ei5E,CGP Grey,Are Daddy Longlegs Spiders?  (Re: 8 Animal Misconceptions Rundown),2012-02-15,2185896
7vsCAM17O-M,CGP Grey,Digital Aristotle: Thoughts on the Future of Education,2012-11-05,2235855
SVmEXdGqO-s,CGP Grey,Thinking About Lockdowns,2020-08-25,2266129
AM1-ecnQsm4,CGP Grey,Q&amp;A With Grey: Favorites Edition,2019-04-28,2287371
GOiIxqcbzyM,CGP Grey,"Q&amp;A With Grey: 500,000 Subscribers Edition",2013-02-25,2384814
U0wTDK0VOeY,CGP Grey,The Coolest &#39;&#39;&#39;&#39;Country&#39;&#39;&#39;&#39;&#39; Flag You Need To Know,2023-03-28,2387971
e-ZpsxnmmbE,CGP Grey,"I, Phone",2016-04-14,2413798
jlLUuX2a0Cg,CGP Grey,Q&amp;A With Grey: Just Because Edition,2018-05-30,2610542
tlsU_YT9n_g,CGP Grey,Q&amp;A With Grey: One Million Subscribers Edition,2013-11-20,2651402
WVZQapdkwLo,CGP Grey,History of the Union Jack,2011-06-06,2703955
QT0I-sdoSXU,CGP Grey,Mixed-Member Proportional Representation Explained,2011-09-26,2709393
_8xhdL8BPvU,CGP Grey,The Battle of SHARKS!,2021-05-23,2817948
wtt2aSV8wdw,CGP Grey,Internet Citizens: Defend Net Neutrality,2014-05-05,2908074
COmW6r23zas,CGP Grey,Supreme Court BANS Faithless Electors…………?,2020-07-10,2914530
bgR3yESAEVE,CGP Grey,"Can Chess, with Hexagons?",2023-07-10,2934614
_95I_1rZiIs,CGP Grey,Primary Elections Explained,2012-02-13,2980181
utDHcbiOfKY,CGP Grey,History Lesson for the History Channel,2012-01-09,2998762
RbUVKXdu4lQ,CGP Grey,A Brief History of Santa,2011-12-19,3182973
K63ZKa_tt3s,CGP Grey,Q&amp;A With Grey: Millenia of Human Attention Edition,2016-03-31,3202788
-FBwZtuJtMw,CGP Grey,A Crime Against Childhood,2021-05-10,3240681
7-Nl4JFDLOU,CGP Grey,Groundhog Day Explained,2012-01-30,3251454
QC-cMv0e3Dc,CGP Grey,Q&amp;A With Grey: Meme Edition,2017-09-19,3336213
nU4E6SSy5Yg,CGP Grey,Canada Gets Rid of the Penny (Huzzah!),2012-04-02,3409997
VPBH1eW28mo,CGP Grey,"Should all locks have keys? Phones, Castles, Encryption, and You.",2016-04-14,3429992
0dU4IMex4FU,CGP Grey,Are US Military Bases and Embassies American Soil?,2014-07-08,3447266
G3wLQz-LgrM,CGP Grey,"Re: The Trouble With The Electoral College – Cities, Metro Areas, Elections and The United States",2016-11-11,3560694
DIssymQvrbU,CGP Grey,YouTube vs Grey: A Ballad of Accidental Suspension,2019-11-24,3578897
orybDrUj4vA,CGP Grey,Quick and Easy Voting for Normal People,2014-11-03,3664679
p3HnMLq8m9U,CGP Grey,How Scotland Joined Great Britain,2011-05-23,3701872
OUS9mM8Xbbw,CGP Grey,How the Electoral College Works,2011-11-07,3911221
_naDg-guomA,CGP Grey,Road Trip After Eight Years Without Driving,2019-05-08,4119022
3Y3jE3B8HsE,CGP Grey,The Alternative Vote Explained,2011-04-07,4179417
9LMr5XTgeyI,CGP Grey,💖 The Tale of Tiffany 💖,2021-08-09,4378621
Mky11UJb9AY,CGP Grey,Gerrymandering Explained,2011-07-12,4457111
NVGuFdX5guE,CGP Grey,Your Theme,2020-01-26,4712968
z1ROpIKZe-c,CGP Grey,London&#39;s Secret Mayor who runs The Secret City,2012-09-19,4775812
kh88fVP2FWQ,CGP Grey,"&#39;Indian&#39; or &#39;Native American&#39;?  [Reservations, Part 0]",2019-11-24,4910620
PCeMCwxayp0,CGP Grey,This abandoned shed may yet help end the world,2020-08-11,4935427
xX96xng7sAE,CGP Grey,What is a Leap Year?,2012-02-28,4994447
gaQwC5QbLeQ,CGP Grey,No Flag Northern Ireland,2019-06-18,5023381
nQHBAdShgYI,CGP Grey,The Trouble with Transporters,2016-03-07,5033443
sHEDXzOfENI,CGP Grey,What If the Electoral College is Tied?,2012-10-10,5048664
snAhsXyO3Ck,CGP Grey,Spaceship You,2020-04-30,5238244
ig_qpNfXHIU,CGP Grey,Death &amp; Dynasties,2016-11-07,5475344
ua4QMFQATco,CGP Grey,CGP Grey was WRONG,2020-08-11,5559711
l8XOZJkozfI,CGP Grey,Politics in the Animal Kingdom: Single Transferable Vote,2014-10-22,5579337
naDCCW5TSpU,CGP Grey,Las Vegas isn&#39;t Las Vegas,2015-04-30,5820852
tUX-frlNBJY,CGP Grey,The Sneaky Plan to Subvert the Electoral College for the Next Election,2019-11-20,5808471
F9-iSl_eg5U,CGP Grey,8 Animal Misconceptions Rundown,2012-02-13,5820201
J1Yv24cM2os,CGP Grey,"🇬🇧🔥 Brexit, Briefly: REVISITED! 🔥🇪🇺",2019-03-10,5943504
jfOUVYQnuhw,CGP Grey,✈️ The Maddening Mess of Airport Codes! ✈️,2022-12-02,5982982
7wC42HgLA4k,CGP Grey,The Trouble with the Electoral College,2011-11-07,5990436
TsXMe8H6iyc,CGP Grey,Where is Scandinavia?,2015-03-25,6188755
s7tWHJfhiyo,CGP Grey,Minority Rule: First Past the Post Voting,2011-03-09,6303702
PM79Epw_cp8,CGP Grey,Your Family Tree Explained,2014-06-04,6542183
bhyYgnhhKFw,CGP Grey,The True Cost of the Royal Family Explained,2011-04-19,6580519
Z_2gbGXzFbs,CGP Grey,Is Pluto a planet?,2012-05-29,6599549
kcc_KAhwpa0,CGP Grey,2012 Didn&#39;t Happen,2011-12-30,6662249
Ex74x_gqTU0,CGP Grey,The Race to Win Staten Island,2019-09-12,6892106
h3ppbbYXMxE,CGP Grey,How to Pronounce Uranus,2012-06-20,7023233
r9rGX91rq5I,CGP Grey,Why the UK Election Results are the Worst in History.,2015-06-16,7145001
DbKNlFcg02c,CGP Grey,Who Owns Antarctica?,2015-12-31,7141340
LrObZ_HZZUc,CGP Grey,The Secret City inside of London Revealed,2012-07-23,7151974
ULBCuHIpNgU,CGP Grey,Not The Confederate Flag?,2015-06-26,7269286
3YFeE1eDlD0,CGP Grey,How to be a Pirate Captain! 🌈  ☠️ 🌈,2020-05-30,7285322
pUF5esTscZI,CGP Grey,Metric Paper,2021-03-26,7328227
C25qzDhGLx8,CGP Grey,Why Die?,2017-10-20,7362460
qEV9qoup2mQ,CGP Grey,Someone Dead Ruined My Life… Again.,2021-09-09,7376451
8Fn_30AD7Pk,CGP Grey,🚛 🚗 The Interstate&#39;s Forgotten Code 🚗 🚛,2022-02-10,7679427
KIbkoop4AYE,CGP Grey,The Debt Limit Explained,2013-01-21,7706673
Vui-qGCfXuA,CGP Grey,Countries inside Countries,2013-05-07,7842978
T0fAznO1wA8,CGP Grey,How to be a Pirate Quartermaster. 📈 💎 📈,2020-06-02,7879928
l4w6808wJcU,CGP Grey,🇺🇸 DOES YOUR FLAG FAIL?  Grey Grades State Flags!,2023-04-02,7904792
KW0eUrUiyxo,CGP Grey,"This Video is Worth $13,085.61",2017-04-05,7938271
WKU0qDpu3AM,CGP Grey,The One Ring Explained,2015-02-09,8351709
qD6bPNZRRbQ,CGP Grey,The Simple Secret of Runway Digits,2022-08-07,8409784
boezS4C_MFc,CGP Grey,The Most Deadly Job in America,2020-10-12,8566076
dDYFiq1l5Dg,CGP Grey,Supreme Court Shenanigans !!!,2020-09-30,8597765
SumDHcnCRuU,CGP Grey,🌍 Which Planet is the Closest?,2019-10-30,8592997
OTVE5iPMKLg,CGP Grey,Coffee: The Greatest Addiction Ever,2011-06-22,8663660
S92fTz_-kQE,CGP Grey,Can Texas Secede from the Union?,2012-12-04,8961539
R9OHn5ZF4Uo,CGP Grey,"How AIs, like ChatGPT, Learn",2017-12-18,9389627
O2hO4_UEe-4,CGP Grey,This Video Will Hurt,2013-12-23,9392636
SCzXZfNIu3A,CGP Grey,Top 10 Misconceptions,2012-01-24,9441905
4AivEQmfPpk,CGP Grey,How Many Countries Are There?,2013-10-23,9546349
LO1mTELoj6o,CGP Grey,7 Ways to Maximize Misery 😞,2017-05-31,9547388
y5UT04p5f7U,CGP Grey,Death to Pennies,2011-11-30,9655108
cZYNADOHhVY,CGP Grey,Fable of the Dragon-Tyrant,2018-04-24,9775167
84aWtseb2-4,CGP Grey,Daylight Saving Time Explained,2011-10-24,9906064
hsWr_JWTZss,CGP Grey,The Trouble With Tumbleweed,2020-03-01,10036504
3uBcq1x7P34,CGP Grey,What are Continents?,2011-09-15,10093340
YxgsxaFWWHQ,CGP Grey,"But What Is Gandalf, Really?",2014-12-17,10283121
rE3j_RHkqJc,CGP Grey,This Video Will Make You Angry,2015-03-10,10330560
Erp8IAUouus,CGP Grey,Your Social Security Card is Insecure,2017-03-29,10736521
BUY6HGqYweQ,CGP Grey,How to Become the British Monarch,2013-07-16,10758050
JEYh5WACqEk,CGP Grey,Americapox: The Missing Plague,2015-11-23,11110275
sYzfKiIWN4g,CGP Grey,5 Historical Misconceptions Rundown,2012-04-18,11396211
ALaTm6VzTBw,CGP Grey,Weekend Wednesday,2020-08-25,11407774
O37yJBFRrfg,CGP Grey,The European Union Explained*,2013-07-02,11901600
SgZ1f4ACZBQ,CGP Grey,Who Owns The Statue of Liberty?,2018-10-30,11934263
OPHRIjI3hXs,CGP Grey,Vatican City Explained,2013-04-09,12191404
eE_IUPInEuc,CGP Grey,Holland vs the Netherlands,2012-12-22,12613761
thOifuHs6eY,CGP Grey,Hexagons are the Bestagons,2020-11-03,12803882
wfYbgdo8e-8,CGP Grey,You Are Two,2016-05-31,13111047
wOmjnioNulo,CGP Grey,Why Zebra Are Terrible Horses,2016-02-29,13115859
LruaD7XhQ50,CGP Grey,Why Nevada Owns Less than 20% of Nevada,2018-11-26,13810388
ASSOQDQvVLU,CGP Grey,American Empire,2014-07-03,13919892
uqH_Y1TupoQ,CGP Grey,The Law You Won&#39;t Be Told,2014-02-12,16263315
7Pq-S557XQU,CGP Grey,Humans Need Not Apply,2014-08-13,16469760
jNgP6d9HraI,CGP Grey,Brief History of the Royal Family,2015-09-09,17610364
rStL7niR7gs,CGP Grey,The Rules for Rulers,2016-10-24,19692855
kF8I_r9XT7A,CGP Grey,How to Become Pope,2013-02-19,22044614
rNu8XDBSn10,CGP Grey,"The Difference between the UK, Great Britain &amp; England Explained",2011-01-30,23567025
oAHbLRjF0vo,CGP Grey,The Better Boarding Method Airlines Won&#39;t Use,2019-02-04,23774328
qMkYlIA7mgw,CGP Grey,Canada &amp; The United States&#39;s Bizarre Border,2013-06-05,26234207
iHzzSao6ypE,CGP Grey,The Simple Solution to Traffic,2016-08-31,37029363
cxQYmY5V07A,Shane2,I Tried EVERY Mountain Dew BAJA BLAST Product EVER Made!,2024-01-24,607357
I56ruiA2lWQ,Shane2,CONSPIRACY THEORIES and ADDRESSING THE GOSSIP!!,2024-01-17,724274
wqLvSLbQ9-o,Shane2,"Pop Culture Conspiracy Theories! STANLEY CUPS, TANACON and HOLLOW EARTH THEORY!",2024-01-31,729038
uemGCEQpGFI,Shane2,POP CULTURE CONSPIRACY THEORIES!! with MORGAN ADAMS!,2023-11-29,846854
OViWpcHHgBE,Shane2,Tasting Every FLAMING HOT CHEETO EVER!!!,2023-10-11,867833
vRDsGxK9xPE,Shane2,MIND BLOWING MANDELA EFFECTS! and DISNEY CONSPIRACIES!!,2023-10-18,885023
N9SHNuV4bJ4,Shane2,CONSPIRACY THEORIES and RESPONDING TO THE LIES!!!,2023-11-15,905919
rsEny7pSpII,Shane2,CONSPIRACY THEORIES and ADDRESSING THE RUMORS!,2023-11-01,938568
-eAGqMDS80M,Shane2,I Tried EVERY Twinkie EVER Made!,2023-08-23,1008928
UogA0NUTweI,Shane2,Conspiracy Theories and We’re Dads!!,2023-12-13,1050907
IsoZ5Wuqy6Y,Shane2,KID SHOW CONSPIRACY THEORIES and CELEBRITY CLONES!!!,2023-08-09,1056134
XhkIXzp5-pA,Shane2,SCARY CONSPIRACY THEORIES! The Most DISTURBING VIDEO ON YOUTUBE! New HALLOWEEN SNACKS!!!,2023-10-04,1118159
ggxFSoVmUAs,Shane2,WE MOVED!!!!! HOUSE TOUR and Tasting VIRAL McDonald’s Foods!,2023-07-05,1118283
LHVJpggl_Xs,Shane2,DISNEYLAND CONSPIRACY THEORIES! PINKYDOLL and TASTING MCDONALDS DISCONTINUED ITEMS!!!,2023-08-30,1138134
FIdT0mTDTmI,Shane2,CONSPIRACY THEORIES and INSANE FAST FOOD TASTE TEST!!,2023-09-13,1136135
fIXkHsRIjO8,Shane2,NEW MANDELA EFFECTS! and 2000’s CONSPIRACY THEORIES!!!,2023-07-26,1137760
Ma65aC2bAOo,Shane2,Trying The Craziest TIK TOK Snacks EVER!!!,2023-05-07,1157897
9hZuUX8nfLg,Shane2,My Day With Jojo Siwa,2023-06-11,1189181
01iQXY-anhc,Shane2,POP CULTURE CONSPIRACY THEORIES and OUR BIG LIFE UPDATE!!!!,2023-07-12,1212174
oBBlUeY-Q-0,Shane2,"Conspiracy Theories! SUPER MARIO BROS, Taco Bell, and A.I. Takeover!",2023-04-26,1235805
VkiB7ru2Esk,Shane2,The Weird World Of WATERTOK... I Tried Them ALL,2023-05-28,1233758
iUvPa6QKiMA,Shane2,CHILDREN SHOW CONSPIRACIES! DISNEY MOVIES and TASTING SCHOOL CAFETERIA FOOD!!? with Katie Morton!,2023-06-28,1274944
s0NYGjc7hS0,Shane2,Conspiracy Theories and AUDIO ILLUSIONS! Can You Hear It?,2022-12-19,1289047
OOPWjtTiAdA,Shane2,GROCERY STORE CONSPIRACY INVESTIGATION,2023-04-06,1322227
q5PRb60ifwo,Shane2,Mandela Effects 2023! We Got Into A BIG FIGHT...,2023-04-11,1332463
e5fanii50zY,Shane2,"DISNEYLAND CONSPIRACY THEORIES! and 100,000 CALORIE CHALLENGE with Erik The Electric and Kristie!",2023-05-31,1342510
ZAYnm2ZROfQ,Shane2,"Mandela Effects! WEDNESDAY, Wonka, and CONSPIRACY THEORIES!!!",2023-05-17,1373260
AZrKXAZsnSQ,Shane2,Craziest Conspiracy Theories! and EXPOSING SCAMS!!!,2023-01-31,1418554
tb6QIKbUjic,Shane2,DISNEY MANDELA EFFECTS! THE BACKROOMS and Ranch Ice Cream??!,2023-06-14,1455199
k_DIGRR3vkg,Shane2,Trying The Craziest Fast Food Hacks EVER!!!,2023-04-20,1469928
0hg0BY19pLs,Shane2,Conspiracy Theories and OUR LAWSUIT!!!,2023-03-21,1500288
R_Yt5TJrKHU,Shane2,MANDELA EFFECTS &amp; MOVIE CONSPIRACY THEORIES: The Shane Dawson Podcast Ep 10,2022-09-19,1555009
0W5Gats9aj4,Shane2,Pop Culture Conspiracy Theories 2023! and MANDELA EFFECTS!!!,2023-03-06,1584722
9EJOHc7u7BA,Shane2,FAST FOOD CONSPIRACY INVESTIGATION,2023-08-16,1584805
1auhpy5xvxw,Shane2,HIDDEN MESSAGES in TV Shows and Conspiracy Theories: The Shane Dawson Podcast Ep 9,2022-09-05,1589122
TCatklmGGnk,Shane2,Mind Blowing Conspiracy Theories! iPhone 14 and Crumbl Cookies EXPOSED! Shane Dawson Podcast Ep 11,2022-10-17,1677099
IPPx8TBCobE,Shane2,Mind Warping Conspiracy Theories: Shane Dawson Podcast Ep 8,2022-08-15,1734688
y1gdbYULeyg,Shane2,Mandela Effects and Subliminal Messages EXPOSED: The Shane Dawson Podcast Ep 7,2022-08-01,1841499
-qe60xec2pA,Shane2,Conspiracy Theories: The Shane Dawson Podcast Ep 1,2022-05-04,1876750
4h-QukGkKOk,Shane2,"Conspiracy Theories and NEW MANDELA EFFECT!!! THE LAST OF US, Pink Sauce, and Fast Food LIES!",2023-02-13,1899874
3wYj7ZRX4Uc,Shane2,Popular Conspiracy Theories and Glitches in the Matrix MIND BLOWN! The Shane Dawson Podcast Ep 6,2022-07-11,1899468
fB8zExtR6PY,Shane2,DISNEY CONSPIRACY THEORY and Big DRAMA with Morgan Adams: The Shane Dawson Podcast Ep 12,2022-11-21,1955679
bg6gcSQDOOk,Shane2,Craziest Pop Culture Conspiracy Theories and Mandela Effect CONFIRMED: The Shane Dawson Podcast Ep 5,2022-06-27,2057772
5BYwAE2hjjU,Shane2,Pop Culture Conspiracy Theories and Mandela Effects MIND BLOWN: The Shane Dawson Podcast Ep 3,2022-05-29,2190642
B3mLXP8fAXI,Shane2,Mind Blowing Conspiracy Theories and Subliminal Messages: The Shane Dawson Podcast Ep 4,2022-06-13,2316742
8RaA26UFbTc,Shane2,Conspiracy Theories 2023! and WE’RE MARRIED!!!!,2023-01-16,2338053
VotVr5YuZjY,Shane2,Mandela Effects and Exposing SCAMS: The Shane Dawson Podcast Ep 2,2022-05-15,2594837
XkeU8w2Y-2Y,Shane2,Test,2020-01-02,4706011
6kYlkcNS4qw,Shane2,Addressing My Weight Gain...,2020-03-06,9389706
QB4vok_FMfw,Shane2,Confronting My Strange Addiction,2020-02-19,10302593
oW78qOFK404,Shane2,The End of the Beauty World,2020-01-21,12439133
pn-Kxynk5cU,Shane2,Conspiracy Theories: Warning Signs with Shane Dawson,2020-02-05,14979638
RTybvkaPne8,Shane2,Craziest Conspiracy Theories,2020-04-04,17195896
Ra1n66hBYHY,DangMattSmith,Weird Things I Wish I NEVER Spotted on Google Maps,2022-04-18,1016320
RzOv8Gby-Mg,DangMattSmith,FUNNIEST SCHOOL TEST ANSWERS Part 36 (Freaking Funny Friday),2022-03-18,1024816
UVriwKKc-aE,DangMattSmith,How the Universe is WAY Bigger Than You Think,2023-02-04,1032119
UqZS0aDBhqg,DangMattSmith,GOODBYE DangMattSmith.. (LAST VIDEO),2020-11-02,1036074
GwSYnqAy3JQ,DangMattSmith,Weird Things I Wish I NEVER Found on Google Maps,2022-03-21,1037933
6V9Ou05rYcA,DangMattSmith,Top 10 Scary Cartoon Stories That Are Actually Terrifying,2022-07-29,1042427
ighzDm4Nxpk,DangMattSmith,Basketball Stuck Inside My Neck..,2022-04-14,1044225
pnNZOoj4EE4,DangMattSmith,FUNNIEST KID TEST ANSWERS Part 39,2022-10-07,1052557
ISKTptabszE,DangMattSmith,Scariest TikToks on the Internet,2022-09-17,1051994
FP79h52lnQg,DangMattSmith,I TRICKED The Vegan Teacher Lunch Lady After She FAILS Me,2021-09-13,1049326
TxzMQY_JlaA,DangMattSmith,Things You Should NEVER Ask SIRI Part 4,2023-04-05,1063152
qA31iBJ_pw8,DangMattSmith,MY GIRLFRIEND Takes The Race Test,2020-09-26,1061512
sYzcXaeeI_4,DangMattSmith,Weird Things Spotted Deeper On Google Maps,2022-01-31,1070904
s_h7pbhoBjE,DangMattSmith,THIS GAME IS IMPOSSIBLE!,2020-09-18,1071169
wFcWtBbdoY4,DangMattSmith,Try Not To Get SCARED Challenge Part 3 (WTF),2020-07-12,1089367
w967i5x6M6s,DangMattSmith,Top 10 Dark Easter Egg Theories In Disney Movies,2022-08-07,1094012
wCVEP7zAhNA,DangMattSmith,Top 10 Scary Broadcast Interruptions,2022-05-21,1094021
qYsWGINLgzE,DangMattSmith,30 Scary Videos Leaving Viewers on Edge,2022-05-28,1095108
te-aFRCA6d4,DangMattSmith,FUNNIEST SCHOOL TEST ANSWERS Part 31 (Freaking Funny Friday),2022-02-11,1098619
-F5T2bU1CI8,DangMattSmith,Top 10 Real Stories That Will TERRIFY You Part 2,2022-07-19,1135386
dHrIem2OgZk,DangMattSmith,"Among Us but Imposter IQ 9,999,999%",2020-10-16,1174963
LDmD7tNReZ4,DangMattSmith,Things You Should NEVER Say To SIRI 2 (AnyThing Thursday),2022-02-10,1179315
VvWDBf2MfYY,DangMattSmith,SCARIEST PLACES You Shouldn&#39;t Visit,2020-05-19,1183975
UHI4FHE80UA,DangMattSmith,Try Not To Get MAD Challenge.. (IMPOSSIBLE),2021-07-19,1200905
nwKwhcIZm2A,DangMattSmith,TikToks That Will Make Your HEART STOP 6,2020-12-07,1208163
6kRzzF_zN_k,DangMattSmith,Trying Dumb LIFE HACKS to see if they work,2021-01-24,1213665
KY1iDP48hjY,DangMattSmith,TRY NOT TO CRY CHALLENGE (very emotional) S1E4 | The Four,2018-01-26,1238821
2pR8Abch0RU,DangMattSmith,HIGH on Chatroulette,2014-08-26,1239046
9h2fEI6hF7E,DangMattSmith,ATTACKED By Chuck E Cheese Creepy Toy Animatronics At Birthday Party.. (WENT MISSING),2021-09-20,1259169
gFPxq9A8zG4,DangMattSmith,It All Started When My Mom Met My Dad (Tik Tok Compilation),2020-04-10,1257250
J7IuL0XHj84,DangMattSmith,Top 10 Scary Cartoon Theories That Will RUIN Your Childhood,2022-07-06,1258380
a46EMLshJA0,DangMattSmith,FUNNY COINCIDENCES That Are UNBELIEVABLE Part 2,2020-05-14,1264140
bQEPGRspZqM,DangMattSmith,DON&#39;T PLAY The Cursed BOUNCE BIG App.. (WTF),2021-05-17,1266524
u3JfiXFblQE,DangMattSmith,DO NOT DOWNLOAD This CURSED APP.. (WTF),2021-05-11,1270519
veCWtuSYye0,DangMattSmith,Messed Up Riddles That Will Trick Your Mind Part 3 (Simply Solving Saturday),2022-01-22,1286980
0PL97GFAYyw,DangMattSmith,Ridiculous Things BANNED in SCHOOLS,2019-05-03,1278863
IXUNpqNL8pA,DangMattSmith,The END OF THE WORLD Happened In GTA 5.. (GTA 5 Mods),2020-09-07,1282987
gggGx5-neK4,DangMattSmith,DON&#39;T PLAY These Cursed Apps.. (WTF),2021-04-25,1287336
SVULHo0951U,DangMattSmith,Top 10 Scary Japanese Urban Legends Part 4,2023-05-13,1292844
O3VaFS2aZQc,DangMattSmith,CREEPIEST Things That Happened On PLANES,2020-03-01,1294394
TUMpLCrE9BM,DangMattSmith,Try Not To Say WOW Challenge Part 2 (IMPOSSIBLE),2020-08-23,1299476
XKc7laecYuI,DangMattSmith,CAN&#39;T STOP on Chatroulette,2013-08-20,1303068
qtyJf7ONv-o,DangMattSmith,Try Not To Look Away Challenge Part 4 ft. Sam and Colby,2022-12-17,1317398
gr3wjk5WrKo,DangMattSmith,A SEXIST Computer Program,2020-09-22,1317975
4dBXGz5siAg,DangMattSmith,"If You See This SMILING MAN In a Maze, RUN AWAY FAST!!",2021-03-23,1320402
1a1tN2Bzmyg,DangMattSmith,Tik Toks Only Siblings Will Understand Part 3,2022-10-27,1327969
Oyb3zN7FUt0,DangMattSmith,SLENDERMAN Spotted In Real Life (HELP),2020-08-01,1324847
5RLNTi4bSsg,DangMattSmith,Pixar Theories That Will Ruin Your Childhood,2022-07-18,1341504
bPLnBZ8tbWE,DangMattSmith,PEOPLE Who Got What They Deserved *INSTANT KARMA*,2019-11-26,1341679
3Fp7y8epjMk,DangMattSmith,Tik Toks Only Siblings Will Understand,2021-09-22,1345700
5RLNTi4bSsg,DangMattSmith,Pixar Theories That Will Ruin Your Childhood,2022-07-18,1341504
bPLnBZ8tbWE,DangMattSmith,PEOPLE Who Got What They Deserved *INSTANT KARMA*,2019-11-26,1341679
3Fp7y8epjMk,DangMattSmith,Tik Toks Only Siblings Will Understand,2021-09-22,1345700
b-16G5gXvNs,DangMattSmith,BABIES See More CREEPY CURSED IMAGES For The First Time!,2021-03-12,1362458
mvjQM2qNQYo,DangMattSmith,Top 10 Scary Nursery Rhyme Dark Origins,2022-05-30,1377921
9jyR0ggvLFs,DangMattSmith,Testing The CREEPY TALKING BABY ANGELA App for the First Time!,2021-04-21,1387920
OZv3C6kFnc4,DangMattSmith,Childhood Crushes,2020-09-16,1396900
sYuJYzvifcU,DangMattSmith,FUNNIEST SCHOOL TEST ANSWERS Part 30 (Freaking Funny Friday),2022-02-04,1405906
I8LrKNyNKUs,DangMattSmith,I TRIED To TEACH DUMB PEOPLE AGAIN But I&#39;m STILL Pretty Dumb,2021-04-23,1411673
04ZA7exRK44,DangMattSmith,AMAZING DISNEY PRINCESS Glow Up Transformations !,2021-03-09,1419202
C1ZhM3GppWA,DangMattSmith,What People Search On Google,2020-09-19,1427277
bSnN0372Cww,DangMattSmith,I Shouldn&#39;t Have Tried This..,2022-04-10,1447078
9fjOyUmW5Lo,DangMattSmith,I was in a COMA but I heard EVERYTHING A TRUE story animation,2020-01-30,1446752
wZSbsB9XDhg,DangMattSmith,When TEACHERS Call Your PARENTS | DangMattSmith,2020-12-23,1486284
jhNUwAmw0XE,DangMattSmith,Tik Toks And Most Oddly Satisfying Giant Poppy Playtime Videos to watch before sleep,2021-11-12,1550011
z1XjFu8WZs0,DangMattSmith,Top 10 Famous Urban Legends That Came To Life,2022-07-17,1565077
4TZGqyVGTEA,DangMattSmith,Top 10 Abandoned Teenagers You Shouldn&#39;t Visit,2022-06-28,1571948
dTggI5ZdUFg,DangMattSmith,30 Scary Videos You Will NEVER Forget,2022-03-13,1573609
rE4ZvPlExOk,DangMattSmith,Try Not To Get ANGRY Challenge.. (EXPERT MODE),2021-09-01,1575528
KPofLTIYoAA,DangMattSmith,Testing All GLITCHES In AMONG US.. (IT WORKS),2020-11-12,1580886
0KnUJ5e8NV4,DangMattSmith,Top 10 Last Photos Of People That Will Make You Shed Tears,2022-06-08,1591426
zvD-Ki_F8lY,DangMattSmith,FUNNIEST KID TEST ANSWERS Part 38,2022-09-30,1613550
2G4Jdpv9d74,DangMattSmith,15 Things Humans Were Never Meant To See,2022-04-19,1621446
97Y7jTzy7_w,DangMattSmith,30 Scary Videos Impossible To Not Be Creepy,2022-10-31,1659866
Rp6geS41Pts,DangMattSmith,FUNNIEST SCHOOL TEST ANSWERS Part 29 (Freaking Funny Friday),2022-01-28,1668906
sjczjcdYfks,DangMattSmith,FUNNIEST SCHOOL TEST ANSWERS Part 35 (Freaking Funny Friday),2022-03-11,1675901
xsLp4EdbZ3A,DangMattSmith,Dark Pixar Theories That Will Ruin Your Childhood,2022-08-10,1671931
k0fNYidYx_w,DangMattSmith,Messed Up RIDDLES to Test your DUMB Friends,2020-05-16,1708913
q5HwpMi6o2I,DangMattSmith,Testing The CREEPY TALKING EMMA App for the First Time!,2021-05-13,1719706
fYU732wMiJw,DangMattSmith,UNNERVING IMAGES That NO ONE Can EXPLAIN!,2021-03-18,1718246
A43KxZintp8,DangMattSmith,Things You Should NEVER Say To SIRI (AnyThing Thursday),2022-01-27,1723838
0jCfacOQqiI,DangMattSmith,School Life Hacks EVERYONE Should Know,2021-01-17,1726199
6kMrPzLyfA4,DangMattSmith,PEOPLE WHO ARE IN A VERY BAD SITUATION Part 2,2020-06-30,1739421
K1bdCVJVX8o,DangMattSmith,These Are the Events That Will Happen Before 2050,2021-05-25,1751833
h84FUIpBEvc,DangMattSmith,I Got BULLIED in GTA 5.. (SAD),2020-09-10,1765584
MUWNzkqetfc,DangMattSmith,Reacting To True Story Scary Animations Part 30 Do Not Watch Before Bed (Super Scary Sunday),2022-01-23,1766867
d4Kqk6gz8TU,DangMattSmith,Haunted House Halloween Animated Horror Story - Part 1,2019-07-02,1778722
4qsiZtSiqus,DangMattSmith,PEOPLE WHO BEAT THE SYSTEM,2019-09-27,1794383
yph48_YhtP8,DangMattSmith,Disney Characters With Cursed Backstories,2022-09-16,1857569
mEpkwitDUHE,DangMattSmith,30 Scary Videos That&#39;ll Make You Call Your Mom,2022-04-20,1859862
CTd3oxYN5jg,DangMattSmith,The Universe is WAY Deeper Than you Think,2021-07-16,1873585
